
         /\      Grafana   /‾‾/  
    /\  /  \     |\  __   /  /   
   /  \/    \    | |/ /  /   ‾‾\ 
  /          \   |   (  |  (‾)  |
 / __________ \  |_|\_\  \_____/ 


     execution: local
        script: tests/k6/vercel-tabs-cache.js
        output: -

     scenarios: (100.00%) 2 scenarios, 125 max VUs, 6m30s max duration (incl. graceful stop):
              * warm_cache: 25 looping VUs for 2m0s (exec: warmCache, gracefulStop: 30s)
              * tabs_traffic_100: 100 looping VUs for 4m0s (exec: tabsTraffic, startTime: 2m0s, gracefulStop: 30s)


running (0m01.0s), 025/125 VUs, 0 complete and 0 interrupted iterations
warm_cache         [   0% ] 25 VUs   0m00.3s/2m0s
tabs_traffic_100 • [   0% ] waiting  1m59.7s

running (0m02.0s), 025/125 VUs, 0 complete and 0 interrupted iterations
warm_cache         [   1% ] 25 VUs   0m01.3s/2m0s
tabs_traffic_100 • [   0% ] waiting  1m58.7s

running (0m03.0s), 025/125 VUs, 0 complete and 0 interrupted iterations
warm_cache         [   2% ] 25 VUs   0m02.3s/2m0s
tabs_traffic_100 • [   0% ] waiting  1m57.7s

running (0m04.0s), 025/125 VUs, 0 complete and 0 interrupted iterations
warm_cache         [   3% ] 25 VUs   0m03.3s/2m0s
tabs_traffic_100 • [   0% ] waiting  1m56.7s

running (0m05.0s), 025/125 VUs, 0 complete and 0 interrupted iterations
warm_cache         [   4% ] 25 VUs   0m04.3s/2m0s
tabs_traffic_100 • [   0% ] waiting  1m55.7s

running (0m06.0s), 025/125 VUs, 0 complete and 0 interrupted iterations
warm_cache         [   4% ] 25 VUs   0m05.3s/2m0s
tabs_traffic_100 • [   0% ] waiting  1m54.7s

running (0m07.0s), 025/125 VUs, 0 complete and 0 interrupted iterations
warm_cache         [   5% ] 25 VUs   0m06.3s/2m0s
tabs_traffic_100 • [   0% ] waiting  1m53.7s

running (0m08.0s), 025/125 VUs, 0 complete and 0 interrupted iterations
warm_cache         [   6% ] 25 VUs   0m07.3s/2m0s
tabs_traffic_100 • [   0% ] waiting  1m52.7s

running (0m09.0s), 025/125 VUs, 0 complete and 0 interrupted iterations
warm_cache         [   7% ] 25 VUs   0m08.3s/2m0s
tabs_traffic_100 • [   0% ] waiting  1m51.7s

running (0m10.0s), 025/125 VUs, 0 complete and 0 interrupted iterations
warm_cache         [   8% ] 25 VUs   0m09.3s/2m0s
tabs_traffic_100 • [   0% ] waiting  1m50.7s

running (0m11.0s), 025/125 VUs, 0 complete and 0 interrupted iterations
warm_cache         [   9% ] 25 VUs   0m10.3s/2m0s
tabs_traffic_100 • [   0% ] waiting  1m49.7s

running (0m12.0s), 025/125 VUs, 0 complete and 0 interrupted iterations
warm_cache         [   9% ] 25 VUs   0m11.3s/2m0s
tabs_traffic_100 • [   0% ] waiting  1m48.7s

running (0m13.0s), 025/125 VUs, 0 complete and 0 interrupted iterations
warm_cache         [  10% ] 25 VUs   0m12.3s/2m0s
tabs_traffic_100 • [   0% ] waiting  1m47.7s

running (0m14.0s), 025/125 VUs, 0 complete and 0 interrupted iterations
warm_cache         [  11% ] 25 VUs   0m13.3s/2m0s
tabs_traffic_100 • [   0% ] waiting  1m46.7s

running (0m15.0s), 025/125 VUs, 0 complete and 0 interrupted iterations
warm_cache         [  12% ] 25 VUs   0m14.3s/2m0s
tabs_traffic_100 • [   0% ] waiting  1m45.7s

running (0m16.0s), 025/125 VUs, 0 complete and 0 interrupted iterations
warm_cache         [  13% ] 25 VUs   0m15.3s/2m0s
tabs_traffic_100 • [   0% ] waiting  1m44.7s

running (0m17.0s), 025/125 VUs, 0 complete and 0 interrupted iterations
warm_cache         [  14% ] 25 VUs   0m16.3s/2m0s
tabs_traffic_100 • [   0% ] waiting  1m43.7s

running (0m18.0s), 025/125 VUs, 0 complete and 0 interrupted iterations
warm_cache         [  14% ] 25 VUs   0m17.3s/2m0s
tabs_traffic_100 • [   0% ] waiting  1m42.7s

running (0m19.0s), 025/125 VUs, 0 complete and 0 interrupted iterations
warm_cache         [  15% ] 25 VUs   0m18.3s/2m0s
tabs_traffic_100 • [   0% ] waiting  1m41.7s

running (0m20.0s), 025/125 VUs, 1 complete and 0 interrupted iterations
warm_cache         [  16% ] 25 VUs   0m19.3s/2m0s
tabs_traffic_100 • [   0% ] waiting  1m40.7s

running (0m21.0s), 025/125 VUs, 1 complete and 0 interrupted iterations
warm_cache         [  17% ] 25 VUs   0m20.3s/2m0s
tabs_traffic_100 • [   0% ] waiting  1m39.7s

running (0m22.0s), 025/125 VUs, 2 complete and 0 interrupted iterations
warm_cache         [  18% ] 25 VUs   0m21.3s/2m0s
tabs_traffic_100 • [   0% ] waiting  1m38.7s

running (0m23.0s), 025/125 VUs, 2 complete and 0 interrupted iterations
warm_cache         [  19% ] 25 VUs   0m22.3s/2m0s
tabs_traffic_100 • [   0% ] waiting  1m37.7s

running (0m24.0s), 025/125 VUs, 2 complete and 0 interrupted iterations
warm_cache         [  19% ] 25 VUs   0m23.3s/2m0s
tabs_traffic_100 • [   0% ] waiting  1m36.7s

running (0m25.0s), 025/125 VUs, 2 complete and 0 interrupted iterations
warm_cache         [  20% ] 25 VUs   0m24.3s/2m0s
tabs_traffic_100 • [   0% ] waiting  1m35.7s

running (0m26.0s), 025/125 VUs, 4 complete and 0 interrupted iterations
warm_cache         [  21% ] 25 VUs   0m25.3s/2m0s
tabs_traffic_100 • [   0% ] waiting  1m34.7s

running (0m27.0s), 025/125 VUs, 5 complete and 0 interrupted iterations
warm_cache         [  22% ] 25 VUs   0m26.3s/2m0s
tabs_traffic_100 • [   0% ] waiting  1m33.7s

running (0m28.0s), 025/125 VUs, 7 complete and 0 interrupted iterations
warm_cache         [  23% ] 25 VUs   0m27.3s/2m0s
tabs_traffic_100 • [   0% ] waiting  1m32.7s

running (0m29.0s), 025/125 VUs, 8 complete and 0 interrupted iterations
warm_cache         [  24% ] 25 VUs   0m28.3s/2m0s
tabs_traffic_100 • [   0% ] waiting  1m31.7s

running (0m30.0s), 025/125 VUs, 10 complete and 0 interrupted iterations
warm_cache         [  24% ] 25 VUs   0m29.3s/2m0s
tabs_traffic_100 • [   0% ] waiting  1m30.7s

running (0m31.0s), 025/125 VUs, 10 complete and 0 interrupted iterations
warm_cache         [  25% ] 25 VUs   0m30.3s/2m0s
tabs_traffic_100 • [   0% ] waiting  1m29.7s

running (0m32.0s), 025/125 VUs, 11 complete and 0 interrupted iterations
warm_cache         [  26% ] 25 VUs   0m31.3s/2m0s
tabs_traffic_100 • [   0% ] waiting  1m28.7s

running (0m33.0s), 025/125 VUs, 13 complete and 0 interrupted iterations
warm_cache         [  27% ] 25 VUs   0m32.3s/2m0s
tabs_traffic_100 • [   0% ] waiting  1m27.7s

running (0m34.0s), 025/125 VUs, 15 complete and 0 interrupted iterations
warm_cache         [  28% ] 25 VUs   0m33.3s/2m0s
tabs_traffic_100 • [   0% ] waiting  1m26.7s

running (0m35.0s), 025/125 VUs, 17 complete and 0 interrupted iterations
warm_cache         [  29% ] 25 VUs   0m34.3s/2m0s
tabs_traffic_100 • [   0% ] waiting  1m25.7s

running (0m36.0s), 025/125 VUs, 19 complete and 0 interrupted iterations
warm_cache         [  29% ] 25 VUs   0m35.3s/2m0s
tabs_traffic_100 • [   0% ] waiting  1m24.7s

running (0m37.0s), 025/125 VUs, 20 complete and 0 interrupted iterations
warm_cache         [  30% ] 25 VUs   0m36.3s/2m0s
tabs_traffic_100 • [   0% ] waiting  1m23.7s

running (0m38.0s), 025/125 VUs, 20 complete and 0 interrupted iterations
warm_cache         [  31% ] 25 VUs   0m37.3s/2m0s
tabs_traffic_100 • [   0% ] waiting  1m22.7s

running (0m39.0s), 025/125 VUs, 22 complete and 0 interrupted iterations
warm_cache         [  32% ] 25 VUs   0m38.3s/2m0s
tabs_traffic_100 • [   0% ] waiting  1m21.7s

running (0m40.0s), 025/125 VUs, 22 complete and 0 interrupted iterations
warm_cache         [  33% ] 25 VUs   0m39.3s/2m0s
tabs_traffic_100 • [   0% ] waiting  1m20.7s

running (0m41.0s), 025/125 VUs, 23 complete and 0 interrupted iterations
warm_cache         [  34% ] 25 VUs   0m40.3s/2m0s
tabs_traffic_100 • [   0% ] waiting  1m19.7s

running (0m42.0s), 025/125 VUs, 24 complete and 0 interrupted iterations
warm_cache         [  34% ] 25 VUs   0m41.3s/2m0s
tabs_traffic_100 • [   0% ] waiting  1m18.7s

running (0m43.0s), 025/125 VUs, 24 complete and 0 interrupted iterations
warm_cache         [  35% ] 25 VUs   0m42.3s/2m0s
tabs_traffic_100 • [   0% ] waiting  1m17.7s

running (0m44.0s), 025/125 VUs, 24 complete and 0 interrupted iterations
warm_cache         [  36% ] 25 VUs   0m43.3s/2m0s
tabs_traffic_100 • [   0% ] waiting  1m16.7s

running (0m45.0s), 025/125 VUs, 24 complete and 0 interrupted iterations
warm_cache         [  37% ] 25 VUs   0m44.3s/2m0s
tabs_traffic_100 • [   0% ] waiting  1m15.7s

running (0m46.0s), 025/125 VUs, 25 complete and 0 interrupted iterations
warm_cache         [  38% ] 25 VUs   0m45.3s/2m0s
tabs_traffic_100 • [   0% ] waiting  1m14.7s

running (0m47.0s), 025/125 VUs, 25 complete and 0 interrupted iterations
warm_cache         [  39% ] 25 VUs   0m46.3s/2m0s
tabs_traffic_100 • [   0% ] waiting  1m13.7s

running (0m48.0s), 025/125 VUs, 25 complete and 0 interrupted iterations
warm_cache         [  39% ] 25 VUs   0m47.3s/2m0s
tabs_traffic_100 • [   0% ] waiting  1m12.7s

running (0m49.0s), 025/125 VUs, 27 complete and 0 interrupted iterations
warm_cache         [  40% ] 25 VUs   0m48.3s/2m0s
tabs_traffic_100 • [   0% ] waiting  1m11.7s

running (0m50.0s), 025/125 VUs, 27 complete and 0 interrupted iterations
warm_cache         [  41% ] 25 VUs   0m49.3s/2m0s
tabs_traffic_100 • [   0% ] waiting  1m10.7s

running (0m51.0s), 025/125 VUs, 28 complete and 0 interrupted iterations
warm_cache         [  42% ] 25 VUs   0m50.3s/2m0s
tabs_traffic_100 • [   0% ] waiting  1m09.7s

running (0m52.0s), 025/125 VUs, 29 complete and 0 interrupted iterations
warm_cache         [  43% ] 25 VUs   0m51.3s/2m0s
tabs_traffic_100 • [   0% ] waiting  1m08.7s

running (0m53.0s), 025/125 VUs, 29 complete and 0 interrupted iterations
warm_cache         [  44% ] 25 VUs   0m52.3s/2m0s
tabs_traffic_100 • [   0% ] waiting  1m07.7s

running (0m54.0s), 025/125 VUs, 30 complete and 0 interrupted iterations
warm_cache         [  44% ] 25 VUs   0m53.3s/2m0s
tabs_traffic_100 • [   0% ] waiting  1m06.7s

running (0m55.0s), 025/125 VUs, 30 complete and 0 interrupted iterations
warm_cache         [  45% ] 25 VUs   0m54.3s/2m0s
tabs_traffic_100 • [   0% ] waiting  1m05.7s

running (0m56.0s), 025/125 VUs, 31 complete and 0 interrupted iterations
warm_cache         [  46% ] 25 VUs   0m55.3s/2m0s
tabs_traffic_100 • [   0% ] waiting  1m04.7s

running (0m57.0s), 025/125 VUs, 33 complete and 0 interrupted iterations
warm_cache         [  47% ] 25 VUs   0m56.3s/2m0s
tabs_traffic_100 • [   0% ] waiting  1m03.7s

running (0m58.0s), 025/125 VUs, 35 complete and 0 interrupted iterations
warm_cache         [  48% ] 25 VUs   0m57.3s/2m0s
tabs_traffic_100 • [   0% ] waiting  1m02.7s

running (0m59.0s), 025/125 VUs, 35 complete and 0 interrupted iterations
warm_cache         [  49% ] 25 VUs   0m58.3s/2m0s
tabs_traffic_100 • [   0% ] waiting  1m01.7s

running (1m00.0s), 025/125 VUs, 35 complete and 0 interrupted iterations
warm_cache         [  49% ] 25 VUs   0m59.3s/2m0s
tabs_traffic_100 • [   0% ] waiting  1m00.7s

running (1m01.0s), 025/125 VUs, 36 complete and 0 interrupted iterations
warm_cache         [  50% ] 25 VUs   1m00.3s/2m0s
tabs_traffic_100 • [   0% ] waiting  0m59.7s

running (1m02.0s), 025/125 VUs, 37 complete and 0 interrupted iterations
warm_cache         [  51% ] 25 VUs   1m01.3s/2m0s
tabs_traffic_100 • [   0% ] waiting  0m58.7s

running (1m03.0s), 025/125 VUs, 38 complete and 0 interrupted iterations
warm_cache         [  52% ] 25 VUs   1m02.3s/2m0s
tabs_traffic_100 • [   0% ] waiting  0m57.7s

running (1m04.0s), 025/125 VUs, 40 complete and 0 interrupted iterations
warm_cache         [  53% ] 25 VUs   1m03.3s/2m0s
tabs_traffic_100 • [   0% ] waiting  0m56.7s

running (1m05.0s), 025/125 VUs, 41 complete and 0 interrupted iterations
warm_cache         [  54% ] 25 VUs   1m04.3s/2m0s
tabs_traffic_100 • [   0% ] waiting  0m55.7s

running (1m06.0s), 025/125 VUs, 41 complete and 0 interrupted iterations
warm_cache         [  54% ] 25 VUs   1m05.3s/2m0s
tabs_traffic_100 • [   0% ] waiting  0m54.7s

running (1m07.0s), 025/125 VUs, 44 complete and 0 interrupted iterations
warm_cache         [  55% ] 25 VUs   1m06.3s/2m0s
tabs_traffic_100 • [   0% ] waiting  0m53.7s

running (1m08.0s), 025/125 VUs, 45 complete and 0 interrupted iterations
warm_cache         [  56% ] 25 VUs   1m07.3s/2m0s
tabs_traffic_100 • [   0% ] waiting  0m52.7s

running (1m09.0s), 025/125 VUs, 46 complete and 0 interrupted iterations
warm_cache         [  57% ] 25 VUs   1m08.3s/2m0s
tabs_traffic_100 • [   0% ] waiting  0m51.7s

running (1m10.0s), 025/125 VUs, 47 complete and 0 interrupted iterations
warm_cache         [  58% ] 25 VUs   1m09.3s/2m0s
tabs_traffic_100 • [   0% ] waiting  0m50.7s

running (1m11.0s), 025/125 VUs, 47 complete and 0 interrupted iterations
warm_cache         [  59% ] 25 VUs   1m10.3s/2m0s
tabs_traffic_100 • [   0% ] waiting  0m49.7s

running (1m12.0s), 025/125 VUs, 50 complete and 0 interrupted iterations
warm_cache         [  59% ] 25 VUs   1m11.3s/2m0s
tabs_traffic_100 • [   0% ] waiting  0m48.7s

running (1m13.0s), 025/125 VUs, 51 complete and 0 interrupted iterations
warm_cache         [  60% ] 25 VUs   1m12.3s/2m0s
tabs_traffic_100 • [   0% ] waiting  0m47.7s

running (1m14.0s), 025/125 VUs, 51 complete and 0 interrupted iterations
warm_cache         [  61% ] 25 VUs   1m13.3s/2m0s
tabs_traffic_100 • [   0% ] waiting  0m46.7s

running (1m15.0s), 025/125 VUs, 52 complete and 0 interrupted iterations
warm_cache         [  62% ] 25 VUs   1m14.3s/2m0s
tabs_traffic_100 • [   0% ] waiting  0m45.7s

running (1m16.0s), 025/125 VUs, 52 complete and 0 interrupted iterations
warm_cache         [  63% ] 25 VUs   1m15.3s/2m0s
tabs_traffic_100 • [   0% ] waiting  0m44.7s

running (1m17.0s), 025/125 VUs, 53 complete and 0 interrupted iterations
warm_cache         [  64% ] 25 VUs   1m16.3s/2m0s
tabs_traffic_100 • [   0% ] waiting  0m43.7s

running (1m18.0s), 025/125 VUs, 53 complete and 0 interrupted iterations
warm_cache         [  64% ] 25 VUs   1m17.3s/2m0s
tabs_traffic_100 • [   0% ] waiting  0m42.7s

running (1m19.0s), 025/125 VUs, 53 complete and 0 interrupted iterations
warm_cache         [  65% ] 25 VUs   1m18.3s/2m0s
tabs_traffic_100 • [   0% ] waiting  0m41.7s

running (1m20.0s), 025/125 VUs, 53 complete and 0 interrupted iterations
warm_cache         [  66% ] 25 VUs   1m19.3s/2m0s
tabs_traffic_100 • [   0% ] waiting  0m40.7s

running (1m21.0s), 025/125 VUs, 54 complete and 0 interrupted iterations
warm_cache         [  67% ] 25 VUs   1m20.3s/2m0s
tabs_traffic_100 • [   0% ] waiting  0m39.7s

running (1m22.0s), 025/125 VUs, 55 complete and 0 interrupted iterations
warm_cache         [  68% ] 25 VUs   1m21.3s/2m0s
tabs_traffic_100 • [   0% ] waiting  0m38.7s

running (1m23.0s), 025/125 VUs, 55 complete and 0 interrupted iterations
warm_cache         [  69% ] 25 VUs   1m22.3s/2m0s
tabs_traffic_100 • [   0% ] waiting  0m37.7s

running (1m24.0s), 025/125 VUs, 55 complete and 0 interrupted iterations
warm_cache         [  69% ] 25 VUs   1m23.3s/2m0s
tabs_traffic_100 • [   0% ] waiting  0m36.7s

running (1m25.0s), 025/125 VUs, 57 complete and 0 interrupted iterations
warm_cache         [  70% ] 25 VUs   1m24.3s/2m0s
tabs_traffic_100 • [   0% ] waiting  0m35.7s

running (1m26.0s), 025/125 VUs, 60 complete and 0 interrupted iterations
warm_cache         [  71% ] 25 VUs   1m25.3s/2m0s
tabs_traffic_100 • [   0% ] waiting  0m34.7s

running (1m27.0s), 025/125 VUs, 61 complete and 0 interrupted iterations
warm_cache         [  72% ] 25 VUs   1m26.3s/2m0s
tabs_traffic_100 • [   0% ] waiting  0m33.7s

running (1m28.0s), 025/125 VUs, 61 complete and 0 interrupted iterations
warm_cache         [  73% ] 25 VUs   1m27.3s/2m0s
tabs_traffic_100 • [   0% ] waiting  0m32.7s

running (1m29.0s), 025/125 VUs, 61 complete and 0 interrupted iterations
warm_cache         [  74% ] 25 VUs   1m28.3s/2m0s
tabs_traffic_100 • [   0% ] waiting  0m31.7s

running (1m30.0s), 025/125 VUs, 61 complete and 0 interrupted iterations
warm_cache         [  74% ] 25 VUs   1m29.3s/2m0s
tabs_traffic_100 • [   0% ] waiting  0m30.7s

running (1m31.0s), 025/125 VUs, 61 complete and 0 interrupted iterations
warm_cache         [  75% ] 25 VUs   1m30.3s/2m0s
tabs_traffic_100 • [   0% ] waiting  0m29.7s

running (1m32.0s), 025/125 VUs, 62 complete and 0 interrupted iterations
warm_cache         [  76% ] 25 VUs   1m31.3s/2m0s
tabs_traffic_100 • [   0% ] waiting  0m28.7s

running (1m33.0s), 025/125 VUs, 62 complete and 0 interrupted iterations
warm_cache         [  77% ] 25 VUs   1m32.3s/2m0s
tabs_traffic_100 • [   0% ] waiting  0m27.7s

running (1m34.0s), 025/125 VUs, 63 complete and 0 interrupted iterations
warm_cache         [  78% ] 25 VUs   1m33.3s/2m0s
tabs_traffic_100 • [   0% ] waiting  0m26.7s

running (1m35.0s), 025/125 VUs, 64 complete and 0 interrupted iterations
warm_cache         [  79% ] 25 VUs   1m34.3s/2m0s
tabs_traffic_100 • [   0% ] waiting  0m25.7s

running (1m36.0s), 025/125 VUs, 66 complete and 0 interrupted iterations
warm_cache         [  79% ] 25 VUs   1m35.3s/2m0s
tabs_traffic_100 • [   0% ] waiting  0m24.7s

running (1m37.0s), 025/125 VUs, 67 complete and 0 interrupted iterations
warm_cache         [  80% ] 25 VUs   1m36.3s/2m0s
tabs_traffic_100 • [   0% ] waiting  0m23.7s

running (1m38.0s), 025/125 VUs, 67 complete and 0 interrupted iterations
warm_cache         [  81% ] 25 VUs   1m37.3s/2m0s
tabs_traffic_100 • [   0% ] waiting  0m22.7s

running (1m39.0s), 025/125 VUs, 69 complete and 0 interrupted iterations
warm_cache         [  82% ] 25 VUs   1m38.3s/2m0s
tabs_traffic_100 • [   0% ] waiting  0m21.7s

running (1m40.0s), 025/125 VUs, 70 complete and 0 interrupted iterations
warm_cache         [  83% ] 25 VUs   1m39.3s/2m0s
tabs_traffic_100 • [   0% ] waiting  0m20.7s

running (1m41.0s), 025/125 VUs, 71 complete and 0 interrupted iterations
warm_cache         [  84% ] 25 VUs   1m40.3s/2m0s
tabs_traffic_100 • [   0% ] waiting  0m19.7s

running (1m42.0s), 025/125 VUs, 73 complete and 0 interrupted iterations
warm_cache         [  84% ] 25 VUs   1m41.3s/2m0s
tabs_traffic_100 • [   0% ] waiting  0m18.7s

running (1m43.0s), 025/125 VUs, 74 complete and 0 interrupted iterations
warm_cache         [  85% ] 25 VUs   1m42.3s/2m0s
tabs_traffic_100 • [   0% ] waiting  0m17.7s

running (1m44.0s), 025/125 VUs, 75 complete and 0 interrupted iterations
warm_cache         [  86% ] 25 VUs   1m43.3s/2m0s
tabs_traffic_100 • [   0% ] waiting  0m16.7s

running (1m45.0s), 025/125 VUs, 76 complete and 0 interrupted iterations
warm_cache         [  87% ] 25 VUs   1m44.3s/2m0s
tabs_traffic_100 • [   0% ] waiting  0m15.7s

running (1m46.0s), 025/125 VUs, 77 complete and 0 interrupted iterations
warm_cache         [  88% ] 25 VUs   1m45.3s/2m0s
tabs_traffic_100 • [   0% ] waiting  0m14.7s

running (1m47.0s), 025/125 VUs, 79 complete and 0 interrupted iterations
warm_cache         [  89% ] 25 VUs   1m46.3s/2m0s
tabs_traffic_100 • [   0% ] waiting  0m13.7s

running (1m48.0s), 025/125 VUs, 80 complete and 0 interrupted iterations
warm_cache         [  89% ] 25 VUs   1m47.3s/2m0s
tabs_traffic_100 • [   0% ] waiting  0m12.7s

running (1m49.0s), 025/125 VUs, 80 complete and 0 interrupted iterations
warm_cache         [  90% ] 25 VUs   1m48.3s/2m0s
tabs_traffic_100 • [   0% ] waiting  0m11.7s

running (1m50.0s), 025/125 VUs, 81 complete and 0 interrupted iterations
warm_cache         [  91% ] 25 VUs   1m49.3s/2m0s
tabs_traffic_100 • [   0% ] waiting  0m10.7s

running (1m51.0s), 025/125 VUs, 81 complete and 0 interrupted iterations
warm_cache         [  92% ] 25 VUs   1m50.3s/2m0s
tabs_traffic_100 • [   0% ] waiting  0m09.7s

running (1m52.0s), 025/125 VUs, 82 complete and 0 interrupted iterations
warm_cache         [  93% ] 25 VUs   1m51.3s/2m0s
tabs_traffic_100 • [   0% ] waiting  0m08.7s

running (1m53.0s), 025/125 VUs, 83 complete and 0 interrupted iterations
warm_cache         [  94% ] 25 VUs   1m52.3s/2m0s
tabs_traffic_100 • [   0% ] waiting  0m07.7s

running (1m54.0s), 025/125 VUs, 83 complete and 0 interrupted iterations
warm_cache         [  94% ] 25 VUs   1m53.3s/2m0s
tabs_traffic_100 • [   0% ] waiting  0m06.7s

running (1m55.0s), 025/125 VUs, 84 complete and 0 interrupted iterations
warm_cache         [  95% ] 25 VUs   1m54.3s/2m0s
tabs_traffic_100 • [   0% ] waiting  0m05.7s

running (1m56.0s), 025/125 VUs, 85 complete and 0 interrupted iterations
warm_cache         [  96% ] 25 VUs   1m55.3s/2m0s
tabs_traffic_100 • [   0% ] waiting  0m04.7s

running (1m57.0s), 025/125 VUs, 87 complete and 0 interrupted iterations
warm_cache         [  97% ] 25 VUs   1m56.3s/2m0s
tabs_traffic_100 • [   0% ] waiting  0m03.7s

running (1m58.0s), 025/125 VUs, 87 complete and 0 interrupted iterations
warm_cache         [  98% ] 25 VUs   1m57.3s/2m0s
tabs_traffic_100 • [   0% ] waiting  0m02.7s

running (1m59.0s), 025/125 VUs, 87 complete and 0 interrupted iterations
warm_cache         [  99% ] 25 VUs   1m58.3s/2m0s
tabs_traffic_100 • [   0% ] waiting  0m01.7s

running (2m00.0s), 025/125 VUs, 87 complete and 0 interrupted iterations
warm_cache         [  99% ] 25 VUs   1m59.3s/2m0s
tabs_traffic_100 • [   0% ] waiting  0m00.7s

running (2m01.0s), 125/125 VUs, 87 complete and 0 interrupted iterations
warm_cache       ↓ [ 100% ] 25 VUs   2m0s
tabs_traffic_100   [   0% ] 100 VUs  0m00.3s/4m0s

running (2m02.0s), 124/125 VUs, 88 complete and 0 interrupted iterations
warm_cache       ↓ [ 100% ] 25 VUs   2m0s
tabs_traffic_100   [   1% ] 100 VUs  0m01.3s/4m0s

running (2m03.0s), 123/125 VUs, 89 complete and 0 interrupted iterations
warm_cache       ↓ [ 100% ] 25 VUs   2m0s
tabs_traffic_100   [   1% ] 100 VUs  0m02.3s/4m0s

running (2m04.0s), 122/125 VUs, 90 complete and 0 interrupted iterations
warm_cache       ↓ [ 100% ] 25 VUs   2m0s
tabs_traffic_100   [   1% ] 100 VUs  0m03.3s/4m0s

running (2m05.0s), 122/125 VUs, 90 complete and 0 interrupted iterations
warm_cache       ↓ [ 100% ] 25 VUs   2m0s
tabs_traffic_100   [   2% ] 100 VUs  0m04.3s/4m0s

running (2m06.0s), 122/125 VUs, 90 complete and 0 interrupted iterations
warm_cache       ↓ [ 100% ] 25 VUs   2m0s
tabs_traffic_100   [   2% ] 100 VUs  0m05.3s/4m0s

running (2m07.0s), 122/125 VUs, 91 complete and 0 interrupted iterations
warm_cache       ↓ [ 100% ] 25 VUs   2m0s
tabs_traffic_100   [   3% ] 100 VUs  0m06.3s/4m0s

running (2m08.0s), 121/125 VUs, 95 complete and 0 interrupted iterations
warm_cache       ↓ [ 100% ] 25 VUs   2m0s
tabs_traffic_100   [   3% ] 100 VUs  0m07.3s/4m0s

running (2m09.0s), 120/125 VUs, 98 complete and 0 interrupted iterations
warm_cache       ↓ [ 100% ] 25 VUs   2m0s
tabs_traffic_100   [   3% ] 100 VUs  0m08.3s/4m0s

running (2m10.0s), 120/125 VUs, 103 complete and 0 interrupted iterations
warm_cache       ↓ [ 100% ] 25 VUs   2m0s
tabs_traffic_100   [   4% ] 100 VUs  0m09.3s/4m0s

running (2m11.0s), 120/125 VUs, 105 complete and 0 interrupted iterations
warm_cache       ↓ [ 100% ] 25 VUs   2m0s
tabs_traffic_100   [   4% ] 100 VUs  0m10.3s/4m0s

running (2m12.0s), 119/125 VUs, 108 complete and 0 interrupted iterations
warm_cache       ↓ [ 100% ] 25 VUs   2m0s
tabs_traffic_100   [   5% ] 100 VUs  0m11.3s/4m0s

running (2m13.0s), 118/125 VUs, 110 complete and 0 interrupted iterations
warm_cache       ↓ [ 100% ] 25 VUs   2m0s
tabs_traffic_100   [   5% ] 100 VUs  0m12.3s/4m0s

running (2m14.0s), 116/125 VUs, 117 complete and 0 interrupted iterations
warm_cache       ↓ [ 100% ] 25 VUs   2m0s
tabs_traffic_100   [   6% ] 100 VUs  0m13.3s/4m0s

running (2m15.0s), 116/125 VUs, 120 complete and 0 interrupted iterations
warm_cache       ↓ [ 100% ] 25 VUs   2m0s
tabs_traffic_100   [   6% ] 100 VUs  0m14.3s/4m0s

running (2m16.0s), 116/125 VUs, 125 complete and 0 interrupted iterations
warm_cache       ↓ [ 100% ] 25 VUs   2m0s
tabs_traffic_100   [   6% ] 100 VUs  0m15.3s/4m0s

running (2m17.0s), 116/125 VUs, 127 complete and 0 interrupted iterations
warm_cache       ↓ [ 100% ] 25 VUs   2m0s
tabs_traffic_100   [   7% ] 100 VUs  0m16.3s/4m0s

running (2m18.0s), 116/125 VUs, 131 complete and 0 interrupted iterations
warm_cache       ↓ [ 100% ] 25 VUs   2m0s
tabs_traffic_100   [   7% ] 100 VUs  0m17.3s/4m0s

running (2m19.0s), 116/125 VUs, 135 complete and 0 interrupted iterations
warm_cache       ↓ [ 100% ] 25 VUs   2m0s
tabs_traffic_100   [   8% ] 100 VUs  0m18.3s/4m0s

running (2m20.0s), 116/125 VUs, 139 complete and 0 interrupted iterations
warm_cache       ↓ [ 100% ] 25 VUs   2m0s
tabs_traffic_100   [   8% ] 100 VUs  0m19.3s/4m0s

running (2m21.0s), 116/125 VUs, 143 complete and 0 interrupted iterations
warm_cache       ↓ [ 100% ] 25 VUs   2m0s
tabs_traffic_100   [   8% ] 100 VUs  0m20.3s/4m0s

running (2m22.0s), 116/125 VUs, 147 complete and 0 interrupted iterations
warm_cache       ↓ [ 100% ] 25 VUs   2m0s
tabs_traffic_100   [   9% ] 100 VUs  0m21.3s/4m0s

running (2m23.0s), 116/125 VUs, 154 complete and 0 interrupted iterations
warm_cache       ↓ [ 100% ] 25 VUs   2m0s
tabs_traffic_100   [   9% ] 100 VUs  0m22.3s/4m0s

running (2m24.0s), 116/125 VUs, 158 complete and 0 interrupted iterations
warm_cache       ↓ [ 100% ] 25 VUs   2m0s
tabs_traffic_100   [  10% ] 100 VUs  0m23.3s/4m0s

running (2m25.0s), 115/125 VUs, 160 complete and 0 interrupted iterations
warm_cache       ↓ [ 100% ] 25 VUs   2m0s
tabs_traffic_100   [  10% ] 100 VUs  0m24.3s/4m0s

running (2m26.0s), 113/125 VUs, 164 complete and 0 interrupted iterations
warm_cache       ↓ [ 100% ] 25 VUs   2m0s
tabs_traffic_100   [  11% ] 100 VUs  0m25.3s/4m0s

running (2m27.0s), 112/125 VUs, 167 complete and 0 interrupted iterations
warm_cache       ↓ [ 100% ] 25 VUs   2m0s
tabs_traffic_100   [  11% ] 100 VUs  0m26.3s/4m0s

running (2m28.0s), 111/125 VUs, 169 complete and 0 interrupted iterations
warm_cache       ↓ [ 100% ] 25 VUs   2m0s
tabs_traffic_100   [  11% ] 100 VUs  0m27.3s/4m0s

running (2m29.0s), 111/125 VUs, 172 complete and 0 interrupted iterations
warm_cache       ↓ [ 100% ] 25 VUs   2m0s
tabs_traffic_100   [  12% ] 100 VUs  0m28.3s/4m0s

running (2m30.0s), 111/125 VUs, 174 complete and 0 interrupted iterations
warm_cache       ↓ [ 100% ] 25 VUs   2m0s
tabs_traffic_100   [  12% ] 100 VUs  0m29.3s/4m0s

running (2m31.0s), 100/125 VUs, 174 complete and 11 interrupted iterations
warm_cache       ✓ [ 100% ] 25 VUs   2m0s
tabs_traffic_100   [  13% ] 100 VUs  0m30.3s/4m0s

running (2m32.0s), 100/125 VUs, 182 complete and 11 interrupted iterations
warm_cache       ✓ [ 100% ] 25 VUs   2m0s
tabs_traffic_100   [  13% ] 100 VUs  0m31.3s/4m0s

running (2m33.0s), 100/125 VUs, 187 complete and 11 interrupted iterations
warm_cache       ✓ [ 100% ] 25 VUs   2m0s
tabs_traffic_100   [  13% ] 100 VUs  0m32.3s/4m0s

running (2m34.0s), 100/125 VUs, 190 complete and 11 interrupted iterations
warm_cache       ✓ [ 100% ] 25 VUs   2m0s
tabs_traffic_100   [  14% ] 100 VUs  0m33.3s/4m0s

running (2m35.0s), 100/125 VUs, 190 complete and 11 interrupted iterations
warm_cache       ✓ [ 100% ] 25 VUs   2m0s
tabs_traffic_100   [  14% ] 100 VUs  0m34.3s/4m0s

running (2m36.0s), 100/125 VUs, 193 complete and 11 interrupted iterations
warm_cache       ✓ [ 100% ] 25 VUs   2m0s
tabs_traffic_100   [  15% ] 100 VUs  0m35.3s/4m0s

running (2m37.0s), 100/125 VUs, 196 complete and 11 interrupted iterations
warm_cache       ✓ [ 100% ] 25 VUs   2m0s
tabs_traffic_100   [  15% ] 100 VUs  0m36.3s/4m0s

running (2m38.0s), 100/125 VUs, 201 complete and 11 interrupted iterations
warm_cache       ✓ [ 100% ] 25 VUs   2m0s
tabs_traffic_100   [  16% ] 100 VUs  0m37.3s/4m0s

running (2m39.0s), 100/125 VUs, 205 complete and 11 interrupted iterations
warm_cache       ✓ [ 100% ] 25 VUs   2m0s
tabs_traffic_100   [  16% ] 100 VUs  0m38.3s/4m0s

running (2m40.0s), 100/125 VUs, 209 complete and 11 interrupted iterations
warm_cache       ✓ [ 100% ] 25 VUs   2m0s
tabs_traffic_100   [  16% ] 100 VUs  0m39.3s/4m0s

running (2m41.0s), 100/125 VUs, 218 complete and 11 interrupted iterations
warm_cache       ✓ [ 100% ] 25 VUs   2m0s
tabs_traffic_100   [  17% ] 100 VUs  0m40.3s/4m0s

running (2m42.0s), 100/125 VUs, 222 complete and 11 interrupted iterations
warm_cache       ✓ [ 100% ] 25 VUs   2m0s
tabs_traffic_100   [  17% ] 100 VUs  0m41.3s/4m0s

running (2m43.0s), 100/125 VUs, 231 complete and 11 interrupted iterations
warm_cache       ✓ [ 100% ] 25 VUs   2m0s
tabs_traffic_100   [  18% ] 100 VUs  0m42.3s/4m0s

running (2m44.0s), 100/125 VUs, 236 complete and 11 interrupted iterations
warm_cache       ✓ [ 100% ] 25 VUs   2m0s
tabs_traffic_100   [  18% ] 100 VUs  0m43.3s/4m0s

running (2m45.0s), 100/125 VUs, 239 complete and 11 interrupted iterations
warm_cache       ✓ [ 100% ] 25 VUs   2m0s
tabs_traffic_100   [  18% ] 100 VUs  0m44.3s/4m0s

running (2m46.0s), 100/125 VUs, 242 complete and 11 interrupted iterations
warm_cache       ✓ [ 100% ] 25 VUs   2m0s
tabs_traffic_100   [  19% ] 100 VUs  0m45.3s/4m0s

running (2m47.0s), 100/125 VUs, 248 complete and 11 interrupted iterations
warm_cache       ✓ [ 100% ] 25 VUs   2m0s
tabs_traffic_100   [  19% ] 100 VUs  0m46.3s/4m0s

running (2m48.0s), 100/125 VUs, 252 complete and 11 interrupted iterations
warm_cache       ✓ [ 100% ] 25 VUs   2m0s
tabs_traffic_100   [  20% ] 100 VUs  0m47.3s/4m0s

running (2m49.0s), 100/125 VUs, 254 complete and 11 interrupted iterations
warm_cache       ✓ [ 100% ] 25 VUs   2m0s
tabs_traffic_100   [  20% ] 100 VUs  0m48.3s/4m0s

running (2m50.0s), 100/125 VUs, 257 complete and 11 interrupted iterations
warm_cache       ✓ [ 100% ] 25 VUs   2m0s
tabs_traffic_100   [  21% ] 100 VUs  0m49.3s/4m0s

running (2m51.0s), 100/125 VUs, 265 complete and 11 interrupted iterations
warm_cache       ✓ [ 100% ] 25 VUs   2m0s
tabs_traffic_100   [  21% ] 100 VUs  0m50.3s/4m0s

running (2m52.0s), 100/125 VUs, 269 complete and 11 interrupted iterations
warm_cache       ✓ [ 100% ] 25 VUs   2m0s
tabs_traffic_100   [  21% ] 100 VUs  0m51.3s/4m0s

running (2m53.0s), 100/125 VUs, 272 complete and 11 interrupted iterations
warm_cache       ✓ [ 100% ] 25 VUs   2m0s
tabs_traffic_100   [  22% ] 100 VUs  0m52.3s/4m0s

running (2m54.0s), 100/125 VUs, 277 complete and 11 interrupted iterations
warm_cache       ✓ [ 100% ] 25 VUs   2m0s
tabs_traffic_100   [  22% ] 100 VUs  0m53.3s/4m0s

running (2m55.0s), 100/125 VUs, 281 complete and 11 interrupted iterations
warm_cache       ✓ [ 100% ] 25 VUs   2m0s
tabs_traffic_100   [  23% ] 100 VUs  0m54.3s/4m0s

running (2m56.0s), 100/125 VUs, 287 complete and 11 interrupted iterations
warm_cache       ✓ [ 100% ] 25 VUs   2m0s
tabs_traffic_100   [  23% ] 100 VUs  0m55.3s/4m0s

running (2m57.0s), 100/125 VUs, 292 complete and 11 interrupted iterations
warm_cache       ✓ [ 100% ] 25 VUs   2m0s
tabs_traffic_100   [  23% ] 100 VUs  0m56.3s/4m0s

running (2m58.0s), 100/125 VUs, 298 complete and 11 interrupted iterations
warm_cache       ✓ [ 100% ] 25 VUs   2m0s
tabs_traffic_100   [  24% ] 100 VUs  0m57.3s/4m0s

running (2m59.0s), 100/125 VUs, 302 complete and 11 interrupted iterations
warm_cache       ✓ [ 100% ] 25 VUs   2m0s
tabs_traffic_100   [  24% ] 100 VUs  0m58.3s/4m0s

running (3m00.0s), 100/125 VUs, 307 complete and 11 interrupted iterations
warm_cache       ✓ [ 100% ] 25 VUs   2m0s
tabs_traffic_100   [  25% ] 100 VUs  0m59.3s/4m0s

running (3m01.0s), 100/125 VUs, 310 complete and 11 interrupted iterations
warm_cache       ✓ [ 100% ] 25 VUs   2m0s
tabs_traffic_100   [  25% ] 100 VUs  1m00.3s/4m0s

running (3m02.0s), 100/125 VUs, 316 complete and 11 interrupted iterations
warm_cache       ✓ [ 100% ] 25 VUs   2m0s
tabs_traffic_100   [  26% ] 100 VUs  1m01.3s/4m0s

running (3m03.0s), 100/125 VUs, 320 complete and 11 interrupted iterations
warm_cache       ✓ [ 100% ] 25 VUs   2m0s
tabs_traffic_100   [  26% ] 100 VUs  1m02.3s/4m0s

running (3m04.0s), 100/125 VUs, 323 complete and 11 interrupted iterations
warm_cache       ✓ [ 100% ] 25 VUs   2m0s
tabs_traffic_100   [  26% ] 100 VUs  1m03.3s/4m0s

running (3m05.0s), 100/125 VUs, 325 complete and 11 interrupted iterations
warm_cache       ✓ [ 100% ] 25 VUs   2m0s
tabs_traffic_100   [  27% ] 100 VUs  1m04.3s/4m0s

running (3m06.0s), 100/125 VUs, 329 complete and 11 interrupted iterations
warm_cache       ✓ [ 100% ] 25 VUs   2m0s
tabs_traffic_100   [  27% ] 100 VUs  1m05.3s/4m0s

running (3m07.0s), 100/125 VUs, 334 complete and 11 interrupted iterations
warm_cache       ✓ [ 100% ] 25 VUs   2m0s
tabs_traffic_100   [  28% ] 100 VUs  1m06.3s/4m0s

running (3m08.0s), 100/125 VUs, 337 complete and 11 interrupted iterations
warm_cache       ✓ [ 100% ] 25 VUs   2m0s
tabs_traffic_100   [  28% ] 100 VUs  1m07.3s/4m0s

running (3m09.0s), 100/125 VUs, 342 complete and 11 interrupted iterations
warm_cache       ✓ [ 100% ] 25 VUs   2m0s
tabs_traffic_100   [  28% ] 100 VUs  1m08.3s/4m0s

running (3m10.0s), 100/125 VUs, 347 complete and 11 interrupted iterations
warm_cache       ✓ [ 100% ] 25 VUs   2m0s
tabs_traffic_100   [  29% ] 100 VUs  1m09.3s/4m0s

running (3m11.0s), 100/125 VUs, 351 complete and 11 interrupted iterations
warm_cache       ✓ [ 100% ] 25 VUs   2m0s
tabs_traffic_100   [  29% ] 100 VUs  1m10.3s/4m0s

running (3m12.0s), 100/125 VUs, 353 complete and 11 interrupted iterations
warm_cache       ✓ [ 100% ] 25 VUs   2m0s
tabs_traffic_100   [  30% ] 100 VUs  1m11.3s/4m0s

running (3m13.0s), 100/125 VUs, 358 complete and 11 interrupted iterations
warm_cache       ✓ [ 100% ] 25 VUs   2m0s
tabs_traffic_100   [  30% ] 100 VUs  1m12.3s/4m0s

running (3m14.0s), 100/125 VUs, 360 complete and 11 interrupted iterations
warm_cache       ✓ [ 100% ] 25 VUs   2m0s
tabs_traffic_100   [  31% ] 100 VUs  1m13.3s/4m0s

running (3m15.0s), 100/125 VUs, 365 complete and 11 interrupted iterations
warm_cache       ✓ [ 100% ] 25 VUs   2m0s
tabs_traffic_100   [  31% ] 100 VUs  1m14.3s/4m0s

running (3m16.0s), 100/125 VUs, 368 complete and 11 interrupted iterations
warm_cache       ✓ [ 100% ] 25 VUs   2m0s
tabs_traffic_100   [  31% ] 100 VUs  1m15.3s/4m0s

running (3m17.0s), 100/125 VUs, 372 complete and 11 interrupted iterations
warm_cache       ✓ [ 100% ] 25 VUs   2m0s
tabs_traffic_100   [  32% ] 100 VUs  1m16.3s/4m0s

running (3m18.0s), 100/125 VUs, 376 complete and 11 interrupted iterations
warm_cache       ✓ [ 100% ] 25 VUs   2m0s
tabs_traffic_100   [  32% ] 100 VUs  1m17.3s/4m0s

running (3m19.0s), 100/125 VUs, 381 complete and 11 interrupted iterations
warm_cache       ✓ [ 100% ] 25 VUs   2m0s
tabs_traffic_100   [  33% ] 100 VUs  1m18.3s/4m0s

running (3m20.0s), 100/125 VUs, 385 complete and 11 interrupted iterations
warm_cache       ✓ [ 100% ] 25 VUs   2m0s
tabs_traffic_100   [  33% ] 100 VUs  1m19.3s/4m0s

running (3m21.0s), 100/125 VUs, 386 complete and 11 interrupted iterations
warm_cache       ✓ [ 100% ] 25 VUs   2m0s
tabs_traffic_100   [  33% ] 100 VUs  1m20.3s/4m0s

running (3m22.0s), 100/125 VUs, 387 complete and 11 interrupted iterations
warm_cache       ✓ [ 100% ] 25 VUs   2m0s
tabs_traffic_100   [  34% ] 100 VUs  1m21.3s/4m0s

running (3m23.0s), 100/125 VUs, 393 complete and 11 interrupted iterations
warm_cache       ✓ [ 100% ] 25 VUs   2m0s
tabs_traffic_100   [  34% ] 100 VUs  1m22.3s/4m0s

running (3m24.0s), 100/125 VUs, 398 complete and 11 interrupted iterations
warm_cache       ✓ [ 100% ] 25 VUs   2m0s
tabs_traffic_100   [  35% ] 100 VUs  1m23.3s/4m0s

running (3m25.0s), 100/125 VUs, 402 complete and 11 interrupted iterations
warm_cache       ✓ [ 100% ] 25 VUs   2m0s
tabs_traffic_100   [  35% ] 100 VUs  1m24.3s/4m0s

running (3m26.0s), 100/125 VUs, 407 complete and 11 interrupted iterations
warm_cache       ✓ [ 100% ] 25 VUs   2m0s
tabs_traffic_100   [  36% ] 100 VUs  1m25.3s/4m0s

running (3m27.0s), 100/125 VUs, 410 complete and 11 interrupted iterations
warm_cache       ✓ [ 100% ] 25 VUs   2m0s
tabs_traffic_100   [  36% ] 100 VUs  1m26.3s/4m0s

running (3m28.0s), 100/125 VUs, 414 complete and 11 interrupted iterations
warm_cache       ✓ [ 100% ] 25 VUs   2m0s
tabs_traffic_100   [  36% ] 100 VUs  1m27.3s/4m0s

running (3m29.0s), 100/125 VUs, 416 complete and 11 interrupted iterations
warm_cache       ✓ [ 100% ] 25 VUs   2m0s
tabs_traffic_100   [  37% ] 100 VUs  1m28.3s/4m0s

running (3m30.0s), 100/125 VUs, 420 complete and 11 interrupted iterations
warm_cache       ✓ [ 100% ] 25 VUs   2m0s
tabs_traffic_100   [  37% ] 100 VUs  1m29.3s/4m0s

running (3m31.0s), 100/125 VUs, 424 complete and 11 interrupted iterations
warm_cache       ✓ [ 100% ] 25 VUs   2m0s
tabs_traffic_100   [  38% ] 100 VUs  1m30.3s/4m0s

running (3m32.0s), 100/125 VUs, 426 complete and 11 interrupted iterations
warm_cache       ✓ [ 100% ] 25 VUs   2m0s
tabs_traffic_100   [  38% ] 100 VUs  1m31.3s/4m0s

running (3m33.0s), 100/125 VUs, 434 complete and 11 interrupted iterations
warm_cache       ✓ [ 100% ] 25 VUs   2m0s
tabs_traffic_100   [  38% ] 100 VUs  1m32.3s/4m0s

running (3m34.0s), 100/125 VUs, 434 complete and 11 interrupted iterations
warm_cache       ✓ [ 100% ] 25 VUs   2m0s
tabs_traffic_100   [  39% ] 100 VUs  1m33.3s/4m0s

running (3m35.0s), 100/125 VUs, 438 complete and 11 interrupted iterations
warm_cache       ✓ [ 100% ] 25 VUs   2m0s
tabs_traffic_100   [  39% ] 100 VUs  1m34.3s/4m0s

running (3m36.0s), 100/125 VUs, 442 complete and 11 interrupted iterations
warm_cache       ✓ [ 100% ] 25 VUs   2m0s
tabs_traffic_100   [  40% ] 100 VUs  1m35.3s/4m0s

running (3m37.0s), 100/125 VUs, 446 complete and 11 interrupted iterations
warm_cache       ✓ [ 100% ] 25 VUs   2m0s
tabs_traffic_100   [  40% ] 100 VUs  1m36.3s/4m0s

running (3m38.0s), 100/125 VUs, 451 complete and 11 interrupted iterations
warm_cache       ✓ [ 100% ] 25 VUs   2m0s
tabs_traffic_100   [  41% ] 100 VUs  1m37.3s/4m0s

running (3m39.0s), 100/125 VUs, 459 complete and 11 interrupted iterations
warm_cache       ✓ [ 100% ] 25 VUs   2m0s
tabs_traffic_100   [  41% ] 100 VUs  1m38.3s/4m0s

running (3m40.0s), 100/125 VUs, 467 complete and 11 interrupted iterations
warm_cache       ✓ [ 100% ] 25 VUs   2m0s
tabs_traffic_100   [  41% ] 100 VUs  1m39.3s/4m0s

running (3m41.0s), 100/125 VUs, 469 complete and 11 interrupted iterations
warm_cache       ✓ [ 100% ] 25 VUs   2m0s
tabs_traffic_100   [  42% ] 100 VUs  1m40.3s/4m0s

running (3m42.0s), 100/125 VUs, 473 complete and 11 interrupted iterations
warm_cache       ✓ [ 100% ] 25 VUs   2m0s
tabs_traffic_100   [  42% ] 100 VUs  1m41.3s/4m0s

running (3m43.0s), 100/125 VUs, 477 complete and 11 interrupted iterations
warm_cache       ✓ [ 100% ] 25 VUs   2m0s
tabs_traffic_100   [  43% ] 100 VUs  1m42.3s/4m0s

running (3m44.0s), 100/125 VUs, 481 complete and 11 interrupted iterations
warm_cache       ✓ [ 100% ] 25 VUs   2m0s
tabs_traffic_100   [  43% ] 100 VUs  1m43.3s/4m0s

running (3m45.0s), 100/125 VUs, 489 complete and 11 interrupted iterations
warm_cache       ✓ [ 100% ] 25 VUs   2m0s
tabs_traffic_100   [  43% ] 100 VUs  1m44.3s/4m0s

running (3m46.0s), 100/125 VUs, 492 complete and 11 interrupted iterations
warm_cache       ✓ [ 100% ] 25 VUs   2m0s
tabs_traffic_100   [  44% ] 100 VUs  1m45.3s/4m0s

running (3m47.0s), 100/125 VUs, 498 complete and 11 interrupted iterations
warm_cache       ✓ [ 100% ] 25 VUs   2m0s
tabs_traffic_100   [  44% ] 100 VUs  1m46.3s/4m0s

running (3m48.0s), 100/125 VUs, 502 complete and 11 interrupted iterations
warm_cache       ✓ [ 100% ] 25 VUs   2m0s
tabs_traffic_100   [  45% ] 100 VUs  1m47.3s/4m0s

running (3m49.0s), 100/125 VUs, 505 complete and 11 interrupted iterations
warm_cache       ✓ [ 100% ] 25 VUs   2m0s
tabs_traffic_100   [  45% ] 100 VUs  1m48.3s/4m0s

running (3m50.0s), 100/125 VUs, 513 complete and 11 interrupted iterations
warm_cache       ✓ [ 100% ] 25 VUs   2m0s
tabs_traffic_100   [  46% ] 100 VUs  1m49.3s/4m0s

running (3m51.0s), 100/125 VUs, 515 complete and 11 interrupted iterations
warm_cache       ✓ [ 100% ] 25 VUs   2m0s
tabs_traffic_100   [  46% ] 100 VUs  1m50.3s/4m0s

running (3m52.0s), 100/125 VUs, 518 complete and 11 interrupted iterations
warm_cache       ✓ [ 100% ] 25 VUs   2m0s
tabs_traffic_100   [  46% ] 100 VUs  1m51.3s/4m0s

running (3m53.0s), 100/125 VUs, 522 complete and 11 interrupted iterations
warm_cache       ✓ [ 100% ] 25 VUs   2m0s
tabs_traffic_100   [  47% ] 100 VUs  1m52.3s/4m0s

running (3m54.0s), 100/125 VUs, 525 complete and 11 interrupted iterations
warm_cache       ✓ [ 100% ] 25 VUs   2m0s
tabs_traffic_100   [  47% ] 100 VUs  1m53.3s/4m0s

running (3m55.0s), 100/125 VUs, 528 complete and 11 interrupted iterations
warm_cache       ✓ [ 100% ] 25 VUs   2m0s
tabs_traffic_100   [  48% ] 100 VUs  1m54.3s/4m0s

running (3m56.0s), 100/125 VUs, 531 complete and 11 interrupted iterations
warm_cache       ✓ [ 100% ] 25 VUs   2m0s
tabs_traffic_100   [  48% ] 100 VUs  1m55.3s/4m0s

running (3m57.0s), 100/125 VUs, 533 complete and 11 interrupted iterations
warm_cache       ✓ [ 100% ] 25 VUs   2m0s
tabs_traffic_100   [  48% ] 100 VUs  1m56.3s/4m0s

running (3m58.0s), 100/125 VUs, 537 complete and 11 interrupted iterations
warm_cache       ✓ [ 100% ] 25 VUs   2m0s
tabs_traffic_100   [  49% ] 100 VUs  1m57.3s/4m0s

running (3m59.0s), 100/125 VUs, 542 complete and 11 interrupted iterations
warm_cache       ✓ [ 100% ] 25 VUs   2m0s
tabs_traffic_100   [  49% ] 100 VUs  1m58.3s/4m0s

running (4m00.0s), 100/125 VUs, 545 complete and 11 interrupted iterations
warm_cache       ✓ [ 100% ] 25 VUs   2m0s
tabs_traffic_100   [  50% ] 100 VUs  1m59.3s/4m0s

running (4m01.0s), 100/125 VUs, 552 complete and 11 interrupted iterations
warm_cache       ✓ [ 100% ] 25 VUs   2m0s
tabs_traffic_100   [  50% ] 100 VUs  2m00.3s/4m0s

running (4m02.0s), 100/125 VUs, 554 complete and 11 interrupted iterations
warm_cache       ✓ [ 100% ] 25 VUs   2m0s
tabs_traffic_100   [  51% ] 100 VUs  2m01.3s/4m0s

running (4m03.0s), 100/125 VUs, 558 complete and 11 interrupted iterations
warm_cache       ✓ [ 100% ] 25 VUs   2m0s
tabs_traffic_100   [  51% ] 100 VUs  2m02.3s/4m0s

running (4m04.0s), 100/125 VUs, 564 complete and 11 interrupted iterations
warm_cache       ✓ [ 100% ] 25 VUs   2m0s
tabs_traffic_100   [  51% ] 100 VUs  2m03.3s/4m0s

running (4m05.0s), 100/125 VUs, 567 complete and 11 interrupted iterations
warm_cache       ✓ [ 100% ] 25 VUs   2m0s
tabs_traffic_100   [  52% ] 100 VUs  2m04.3s/4m0s

running (4m06.0s), 100/125 VUs, 571 complete and 11 interrupted iterations
warm_cache       ✓ [ 100% ] 25 VUs   2m0s
tabs_traffic_100   [  52% ] 100 VUs  2m05.3s/4m0s

running (4m07.0s), 100/125 VUs, 575 complete and 11 interrupted iterations
warm_cache       ✓ [ 100% ] 25 VUs   2m0s
tabs_traffic_100   [  53% ] 100 VUs  2m06.3s/4m0s

running (4m08.0s), 100/125 VUs, 578 complete and 11 interrupted iterations
warm_cache       ✓ [ 100% ] 25 VUs   2m0s
tabs_traffic_100   [  53% ] 100 VUs  2m07.3s/4m0s

running (4m09.0s), 100/125 VUs, 585 complete and 11 interrupted iterations
warm_cache       ✓ [ 100% ] 25 VUs   2m0s
tabs_traffic_100   [  53% ] 100 VUs  2m08.3s/4m0s

running (4m10.0s), 100/125 VUs, 591 complete and 11 interrupted iterations
warm_cache       ✓ [ 100% ] 25 VUs   2m0s
tabs_traffic_100   [  54% ] 100 VUs  2m09.3s/4m0s

running (4m11.0s), 100/125 VUs, 599 complete and 11 interrupted iterations
warm_cache       ✓ [ 100% ] 25 VUs   2m0s
tabs_traffic_100   [  54% ] 100 VUs  2m10.3s/4m0s

running (4m12.0s), 100/125 VUs, 602 complete and 11 interrupted iterations
warm_cache       ✓ [ 100% ] 25 VUs   2m0s
tabs_traffic_100   [  55% ] 100 VUs  2m11.3s/4m0s

running (4m13.0s), 100/125 VUs, 607 complete and 11 interrupted iterations
warm_cache       ✓ [ 100% ] 25 VUs   2m0s
tabs_traffic_100   [  55% ] 100 VUs  2m12.3s/4m0s

running (4m14.0s), 100/125 VUs, 608 complete and 11 interrupted iterations
warm_cache       ✓ [ 100% ] 25 VUs   2m0s
tabs_traffic_100   [  56% ] 100 VUs  2m13.3s/4m0s

running (4m15.0s), 100/125 VUs, 612 complete and 11 interrupted iterations
warm_cache       ✓ [ 100% ] 25 VUs   2m0s
tabs_traffic_100   [  56% ] 100 VUs  2m14.3s/4m0s

running (4m16.0s), 100/125 VUs, 616 complete and 11 interrupted iterations
warm_cache       ✓ [ 100% ] 25 VUs   2m0s
tabs_traffic_100   [  56% ] 100 VUs  2m15.3s/4m0s

running (4m17.0s), 100/125 VUs, 624 complete and 11 interrupted iterations
warm_cache       ✓ [ 100% ] 25 VUs   2m0s
tabs_traffic_100   [  57% ] 100 VUs  2m16.3s/4m0s

running (4m18.0s), 100/125 VUs, 629 complete and 11 interrupted iterations
warm_cache       ✓ [ 100% ] 25 VUs   2m0s
tabs_traffic_100   [  57% ] 100 VUs  2m17.3s/4m0s

running (4m19.0s), 100/125 VUs, 634 complete and 11 interrupted iterations
warm_cache       ✓ [ 100% ] 25 VUs   2m0s
tabs_traffic_100   [  58% ] 100 VUs  2m18.3s/4m0s

running (4m20.0s), 100/125 VUs, 639 complete and 11 interrupted iterations
warm_cache       ✓ [ 100% ] 25 VUs   2m0s
tabs_traffic_100   [  58% ] 100 VUs  2m19.3s/4m0s

running (4m21.0s), 100/125 VUs, 640 complete and 11 interrupted iterations
warm_cache       ✓ [ 100% ] 25 VUs   2m0s
tabs_traffic_100   [  58% ] 100 VUs  2m20.3s/4m0s

running (4m22.0s), 100/125 VUs, 644 complete and 11 interrupted iterations
warm_cache       ✓ [ 100% ] 25 VUs   2m0s
tabs_traffic_100   [  59% ] 100 VUs  2m21.3s/4m0s

running (4m23.0s), 100/125 VUs, 648 complete and 11 interrupted iterations
warm_cache       ✓ [ 100% ] 25 VUs   2m0s
tabs_traffic_100   [  59% ] 100 VUs  2m22.3s/4m0s

running (4m24.0s), 100/125 VUs, 652 complete and 11 interrupted iterations
warm_cache       ✓ [ 100% ] 25 VUs   2m0s
tabs_traffic_100   [  60% ] 100 VUs  2m23.3s/4m0s

running (4m25.0s), 100/125 VUs, 657 complete and 11 interrupted iterations
warm_cache       ✓ [ 100% ] 25 VUs   2m0s
tabs_traffic_100   [  60% ] 100 VUs  2m24.3s/4m0s

running (4m26.0s), 100/125 VUs, 661 complete and 11 interrupted iterations
warm_cache       ✓ [ 100% ] 25 VUs   2m0s
tabs_traffic_100   [  61% ] 100 VUs  2m25.3s/4m0s

running (4m27.0s), 100/125 VUs, 662 complete and 11 interrupted iterations
warm_cache       ✓ [ 100% ] 25 VUs   2m0s
tabs_traffic_100   [  61% ] 100 VUs  2m26.3s/4m0s

running (4m28.0s), 100/125 VUs, 667 complete and 11 interrupted iterations
warm_cache       ✓ [ 100% ] 25 VUs   2m0s
tabs_traffic_100   [  61% ] 100 VUs  2m27.3s/4m0s

running (4m29.0s), 100/125 VUs, 673 complete and 11 interrupted iterations
warm_cache       ✓ [ 100% ] 25 VUs   2m0s
tabs_traffic_100   [  62% ] 100 VUs  2m28.3s/4m0s

running (4m30.0s), 100/125 VUs, 679 complete and 11 interrupted iterations
warm_cache       ✓ [ 100% ] 25 VUs   2m0s
tabs_traffic_100   [  62% ] 100 VUs  2m29.3s/4m0s

running (4m31.0s), 100/125 VUs, 684 complete and 11 interrupted iterations
warm_cache       ✓ [ 100% ] 25 VUs   2m0s
tabs_traffic_100   [  63% ] 100 VUs  2m30.3s/4m0s

running (4m32.0s), 100/125 VUs, 687 complete and 11 interrupted iterations
warm_cache       ✓ [ 100% ] 25 VUs   2m0s
tabs_traffic_100   [  63% ] 100 VUs  2m31.3s/4m0s

running (4m33.0s), 100/125 VUs, 692 complete and 11 interrupted iterations
warm_cache       ✓ [ 100% ] 25 VUs   2m0s
tabs_traffic_100   [  63% ] 100 VUs  2m32.3s/4m0s

running (4m34.0s), 100/125 VUs, 694 complete and 11 interrupted iterations
warm_cache       ✓ [ 100% ] 25 VUs   2m0s
tabs_traffic_100   [  64% ] 100 VUs  2m33.3s/4m0s

running (4m35.0s), 100/125 VUs, 698 complete and 11 interrupted iterations
warm_cache       ✓ [ 100% ] 25 VUs   2m0s
tabs_traffic_100   [  64% ] 100 VUs  2m34.3s/4m0s

running (4m36.0s), 100/125 VUs, 703 complete and 11 interrupted iterations
warm_cache       ✓ [ 100% ] 25 VUs   2m0s
tabs_traffic_100   [  65% ] 100 VUs  2m35.3s/4m0s

running (4m37.0s), 100/125 VUs, 706 complete and 11 interrupted iterations
warm_cache       ✓ [ 100% ] 25 VUs   2m0s
tabs_traffic_100   [  65% ] 100 VUs  2m36.3s/4m0s

running (4m38.0s), 100/125 VUs, 708 complete and 11 interrupted iterations
warm_cache       ✓ [ 100% ] 25 VUs   2m0s
tabs_traffic_100   [  66% ] 100 VUs  2m37.3s/4m0s

running (4m39.0s), 100/125 VUs, 713 complete and 11 interrupted iterations
warm_cache       ✓ [ 100% ] 25 VUs   2m0s
tabs_traffic_100   [  66% ] 100 VUs  2m38.3s/4m0s

running (4m40.0s), 100/125 VUs, 719 complete and 11 interrupted iterations
warm_cache       ✓ [ 100% ] 25 VUs   2m0s
tabs_traffic_100   [  66% ] 100 VUs  2m39.3s/4m0s

running (4m41.0s), 100/125 VUs, 724 complete and 11 interrupted iterations
warm_cache       ✓ [ 100% ] 25 VUs   2m0s
tabs_traffic_100   [  67% ] 100 VUs  2m40.3s/4m0s

running (4m42.0s), 100/125 VUs, 730 complete and 11 interrupted iterations
warm_cache       ✓ [ 100% ] 25 VUs   2m0s
tabs_traffic_100   [  67% ] 100 VUs  2m41.3s/4m0s

running (4m43.0s), 100/125 VUs, 733 complete and 11 interrupted iterations
warm_cache       ✓ [ 100% ] 25 VUs   2m0s
tabs_traffic_100   [  68% ] 100 VUs  2m42.3s/4m0s

running (4m44.0s), 100/125 VUs, 739 complete and 11 interrupted iterations
warm_cache       ✓ [ 100% ] 25 VUs   2m0s
tabs_traffic_100   [  68% ] 100 VUs  2m43.3s/4m0s

running (4m45.0s), 100/125 VUs, 742 complete and 11 interrupted iterations
warm_cache       ✓ [ 100% ] 25 VUs   2m0s
tabs_traffic_100   [  68% ] 100 VUs  2m44.3s/4m0s

running (4m46.0s), 100/125 VUs, 748 complete and 11 interrupted iterations
warm_cache       ✓ [ 100% ] 25 VUs   2m0s
tabs_traffic_100   [  69% ] 100 VUs  2m45.3s/4m0s

running (4m47.0s), 100/125 VUs, 753 complete and 11 interrupted iterations
warm_cache       ✓ [ 100% ] 25 VUs   2m0s
tabs_traffic_100   [  69% ] 100 VUs  2m46.3s/4m0s

running (4m48.0s), 100/125 VUs, 757 complete and 11 interrupted iterations
warm_cache       ✓ [ 100% ] 25 VUs   2m0s
tabs_traffic_100   [  70% ] 100 VUs  2m47.3s/4m0s

running (4m49.0s), 100/125 VUs, 761 complete and 11 interrupted iterations
warm_cache       ✓ [ 100% ] 25 VUs   2m0s
tabs_traffic_100   [  70% ] 100 VUs  2m48.3s/4m0s

running (4m50.0s), 100/125 VUs, 766 complete and 11 interrupted iterations
warm_cache       ✓ [ 100% ] 25 VUs   2m0s
tabs_traffic_100   [  71% ] 100 VUs  2m49.3s/4m0s

running (4m51.0s), 100/125 VUs, 771 complete and 11 interrupted iterations
warm_cache       ✓ [ 100% ] 25 VUs   2m0s
tabs_traffic_100   [  71% ] 100 VUs  2m50.3s/4m0s

running (4m52.0s), 100/125 VUs, 774 complete and 11 interrupted iterations
warm_cache       ✓ [ 100% ] 25 VUs   2m0s
tabs_traffic_100   [  71% ] 100 VUs  2m51.3s/4m0s

running (4m53.0s), 100/125 VUs, 775 complete and 11 interrupted iterations
warm_cache       ✓ [ 100% ] 25 VUs   2m0s
tabs_traffic_100   [  72% ] 100 VUs  2m52.3s/4m0s

running (4m54.0s), 100/125 VUs, 779 complete and 11 interrupted iterations
warm_cache       ✓ [ 100% ] 25 VUs   2m0s
tabs_traffic_100   [  72% ] 100 VUs  2m53.3s/4m0s

running (4m55.0s), 100/125 VUs, 786 complete and 11 interrupted iterations
warm_cache       ✓ [ 100% ] 25 VUs   2m0s
tabs_traffic_100   [  73% ] 100 VUs  2m54.3s/4m0s

running (4m56.0s), 100/125 VUs, 792 complete and 11 interrupted iterations
warm_cache       ✓ [ 100% ] 25 VUs   2m0s
tabs_traffic_100   [  73% ] 100 VUs  2m55.3s/4m0s

running (4m57.0s), 100/125 VUs, 793 complete and 11 interrupted iterations
warm_cache       ✓ [ 100% ] 25 VUs   2m0s
tabs_traffic_100   [  73% ] 100 VUs  2m56.3s/4m0s

running (4m58.0s), 100/125 VUs, 796 complete and 11 interrupted iterations
warm_cache       ✓ [ 100% ] 25 VUs   2m0s
tabs_traffic_100   [  74% ] 100 VUs  2m57.3s/4m0s

running (4m59.0s), 100/125 VUs, 800 complete and 11 interrupted iterations
warm_cache       ✓ [ 100% ] 25 VUs   2m0s
tabs_traffic_100   [  74% ] 100 VUs  2m58.3s/4m0s

running (5m00.0s), 100/125 VUs, 804 complete and 11 interrupted iterations
warm_cache       ✓ [ 100% ] 25 VUs   2m0s
tabs_traffic_100   [  75% ] 100 VUs  2m59.3s/4m0s

running (5m01.0s), 100/125 VUs, 806 complete and 11 interrupted iterations
warm_cache       ✓ [ 100% ] 25 VUs   2m0s
tabs_traffic_100   [  75% ] 100 VUs  3m00.3s/4m0s

running (5m02.0s), 100/125 VUs, 810 complete and 11 interrupted iterations
warm_cache       ✓ [ 100% ] 25 VUs   2m0s
tabs_traffic_100   [  76% ] 100 VUs  3m01.3s/4m0s

running (5m03.0s), 100/125 VUs, 814 complete and 11 interrupted iterations
warm_cache       ✓ [ 100% ] 25 VUs   2m0s
tabs_traffic_100   [  76% ] 100 VUs  3m02.3s/4m0s

running (5m04.0s), 100/125 VUs, 817 complete and 11 interrupted iterations
warm_cache       ✓ [ 100% ] 25 VUs   2m0s
tabs_traffic_100   [  76% ] 100 VUs  3m03.3s/4m0s

running (5m05.0s), 100/125 VUs, 824 complete and 11 interrupted iterations
warm_cache       ✓ [ 100% ] 25 VUs   2m0s
tabs_traffic_100   [  77% ] 100 VUs  3m04.3s/4m0s

running (5m06.0s), 100/125 VUs, 824 complete and 11 interrupted iterations
warm_cache       ✓ [ 100% ] 25 VUs   2m0s
tabs_traffic_100   [  77% ] 100 VUs  3m05.3s/4m0s

running (5m07.0s), 100/125 VUs, 831 complete and 11 interrupted iterations
warm_cache       ✓ [ 100% ] 25 VUs   2m0s
tabs_traffic_100   [  78% ] 100 VUs  3m06.3s/4m0s

running (5m08.0s), 100/125 VUs, 834 complete and 11 interrupted iterations
warm_cache       ✓ [ 100% ] 25 VUs   2m0s
tabs_traffic_100   [  78% ] 100 VUs  3m07.3s/4m0s

running (5m09.0s), 100/125 VUs, 836 complete and 11 interrupted iterations
warm_cache       ✓ [ 100% ] 25 VUs   2m0s
tabs_traffic_100   [  78% ] 100 VUs  3m08.3s/4m0s

running (5m10.0s), 100/125 VUs, 842 complete and 11 interrupted iterations
warm_cache       ✓ [ 100% ] 25 VUs   2m0s
tabs_traffic_100   [  79% ] 100 VUs  3m09.3s/4m0s

running (5m11.0s), 100/125 VUs, 850 complete and 11 interrupted iterations
warm_cache       ✓ [ 100% ] 25 VUs   2m0s
tabs_traffic_100   [  79% ] 100 VUs  3m10.3s/4m0s

running (5m12.0s), 100/125 VUs, 854 complete and 11 interrupted iterations
warm_cache       ✓ [ 100% ] 25 VUs   2m0s
tabs_traffic_100   [  80% ] 100 VUs  3m11.3s/4m0s

running (5m13.0s), 100/125 VUs, 859 complete and 11 interrupted iterations
warm_cache       ✓ [ 100% ] 25 VUs   2m0s
tabs_traffic_100   [  80% ] 100 VUs  3m12.3s/4m0s

running (5m14.0s), 100/125 VUs, 861 complete and 11 interrupted iterations
warm_cache       ✓ [ 100% ] 25 VUs   2m0s
tabs_traffic_100   [  81% ] 100 VUs  3m13.3s/4m0s

running (5m15.0s), 100/125 VUs, 869 complete and 11 interrupted iterations
warm_cache       ✓ [ 100% ] 25 VUs   2m0s
tabs_traffic_100   [  81% ] 100 VUs  3m14.3s/4m0s

running (5m16.0s), 100/125 VUs, 874 complete and 11 interrupted iterations
warm_cache       ✓ [ 100% ] 25 VUs   2m0s
tabs_traffic_100   [  81% ] 100 VUs  3m15.3s/4m0s

running (5m17.0s), 100/125 VUs, 876 complete and 11 interrupted iterations
warm_cache       ✓ [ 100% ] 25 VUs   2m0s
tabs_traffic_100   [  82% ] 100 VUs  3m16.3s/4m0s

running (5m18.0s), 100/125 VUs, 878 complete and 11 interrupted iterations
warm_cache       ✓ [ 100% ] 25 VUs   2m0s
tabs_traffic_100   [  82% ] 100 VUs  3m17.3s/4m0s

running (5m19.0s), 100/125 VUs, 883 complete and 11 interrupted iterations
warm_cache       ✓ [ 100% ] 25 VUs   2m0s
tabs_traffic_100   [  83% ] 100 VUs  3m18.3s/4m0s

running (5m20.0s), 100/125 VUs, 889 complete and 11 interrupted iterations
warm_cache       ✓ [ 100% ] 25 VUs   2m0s
tabs_traffic_100   [  83% ] 100 VUs  3m19.3s/4m0s

running (5m21.0s), 100/125 VUs, 896 complete and 11 interrupted iterations
warm_cache       ✓ [ 100% ] 25 VUs   2m0s
tabs_traffic_100   [  83% ] 100 VUs  3m20.3s/4m0s

running (5m22.0s), 100/125 VUs, 899 complete and 11 interrupted iterations
warm_cache       ✓ [ 100% ] 25 VUs   2m0s
tabs_traffic_100   [  84% ] 100 VUs  3m21.3s/4m0s

running (5m23.0s), 100/125 VUs, 903 complete and 11 interrupted iterations
warm_cache       ✓ [ 100% ] 25 VUs   2m0s
tabs_traffic_100   [  84% ] 100 VUs  3m22.3s/4m0s

running (5m24.0s), 100/125 VUs, 904 complete and 11 interrupted iterations
warm_cache       ✓ [ 100% ] 25 VUs   2m0s
tabs_traffic_100   [  85% ] 100 VUs  3m23.3s/4m0s

running (5m25.0s), 100/125 VUs, 910 complete and 11 interrupted iterations
warm_cache       ✓ [ 100% ] 25 VUs   2m0s
tabs_traffic_100   [  85% ] 100 VUs  3m24.3s/4m0s

running (5m26.0s), 100/125 VUs, 913 complete and 11 interrupted iterations
warm_cache       ✓ [ 100% ] 25 VUs   2m0s
tabs_traffic_100   [  86% ] 100 VUs  3m25.3s/4m0s

running (5m27.0s), 100/125 VUs, 918 complete and 11 interrupted iterations
warm_cache       ✓ [ 100% ] 25 VUs   2m0s
tabs_traffic_100   [  86% ] 100 VUs  3m26.3s/4m0s

running (5m28.0s), 100/125 VUs, 922 complete and 11 interrupted iterations
warm_cache       ✓ [ 100% ] 25 VUs   2m0s
tabs_traffic_100   [  86% ] 100 VUs  3m27.3s/4m0s

running (5m29.0s), 100/125 VUs, 925 complete and 11 interrupted iterations
warm_cache       ✓ [ 100% ] 25 VUs   2m0s
tabs_traffic_100   [  87% ] 100 VUs  3m28.3s/4m0s

running (5m30.0s), 100/125 VUs, 929 complete and 11 interrupted iterations
warm_cache       ✓ [ 100% ] 25 VUs   2m0s
tabs_traffic_100   [  87% ] 100 VUs  3m29.3s/4m0s

running (5m31.0s), 100/125 VUs, 934 complete and 11 interrupted iterations
warm_cache       ✓ [ 100% ] 25 VUs   2m0s
tabs_traffic_100   [  88% ] 100 VUs  3m30.3s/4m0s

running (5m32.0s), 100/125 VUs, 939 complete and 11 interrupted iterations
warm_cache       ✓ [ 100% ] 25 VUs   2m0s
tabs_traffic_100   [  88% ] 100 VUs  3m31.3s/4m0s

running (5m33.0s), 100/125 VUs, 942 complete and 11 interrupted iterations
warm_cache       ✓ [ 100% ] 25 VUs   2m0s
tabs_traffic_100   [  88% ] 100 VUs  3m32.3s/4m0s

running (5m34.0s), 100/125 VUs, 945 complete and 11 interrupted iterations
warm_cache       ✓ [ 100% ] 25 VUs   2m0s
tabs_traffic_100   [  89% ] 100 VUs  3m33.3s/4m0s

running (5m35.0s), 100/125 VUs, 951 complete and 11 interrupted iterations
warm_cache       ✓ [ 100% ] 25 VUs   2m0s
tabs_traffic_100   [  89% ] 100 VUs  3m34.3s/4m0s

running (5m36.0s), 100/125 VUs, 952 complete and 11 interrupted iterations
warm_cache       ✓ [ 100% ] 25 VUs   2m0s
tabs_traffic_100   [  90% ] 100 VUs  3m35.3s/4m0s

running (5m37.0s), 100/125 VUs, 956 complete and 11 interrupted iterations
warm_cache       ✓ [ 100% ] 25 VUs   2m0s
tabs_traffic_100   [  90% ] 100 VUs  3m36.3s/4m0s

running (5m38.0s), 100/125 VUs, 961 complete and 11 interrupted iterations
warm_cache       ✓ [ 100% ] 25 VUs   2m0s
tabs_traffic_100   [  91% ] 100 VUs  3m37.3s/4m0s

running (5m39.0s), 100/125 VUs, 964 complete and 11 interrupted iterations
warm_cache       ✓ [ 100% ] 25 VUs   2m0s
tabs_traffic_100   [  91% ] 100 VUs  3m38.3s/4m0s

running (5m40.0s), 100/125 VUs, 968 complete and 11 interrupted iterations
warm_cache       ✓ [ 100% ] 25 VUs   2m0s
tabs_traffic_100   [  91% ] 100 VUs  3m39.3s/4m0s

running (5m41.0s), 100/125 VUs, 972 complete and 11 interrupted iterations
warm_cache       ✓ [ 100% ] 25 VUs   2m0s
tabs_traffic_100   [  92% ] 100 VUs  3m40.3s/4m0s

running (5m42.0s), 100/125 VUs, 973 complete and 11 interrupted iterations
warm_cache       ✓ [ 100% ] 25 VUs   2m0s
tabs_traffic_100   [  92% ] 100 VUs  3m41.3s/4m0s

running (5m43.0s), 100/125 VUs, 976 complete and 11 interrupted iterations
warm_cache       ✓ [ 100% ] 25 VUs   2m0s
tabs_traffic_100   [  93% ] 100 VUs  3m42.3s/4m0s

running (5m44.0s), 100/125 VUs, 981 complete and 11 interrupted iterations
warm_cache       ✓ [ 100% ] 25 VUs   2m0s
tabs_traffic_100   [  93% ] 100 VUs  3m43.3s/4m0s

running (5m45.0s), 100/125 VUs, 986 complete and 11 interrupted iterations
warm_cache       ✓ [ 100% ] 25 VUs   2m0s
tabs_traffic_100   [  93% ] 100 VUs  3m44.3s/4m0s

running (5m46.0s), 100/125 VUs, 990 complete and 11 interrupted iterations
warm_cache       ✓ [ 100% ] 25 VUs   2m0s
tabs_traffic_100   [  94% ] 100 VUs  3m45.3s/4m0s

running (5m47.0s), 100/125 VUs, 998 complete and 11 interrupted iterations
warm_cache       ✓ [ 100% ] 25 VUs   2m0s
tabs_traffic_100   [  94% ] 100 VUs  3m46.3s/4m0s

running (5m48.0s), 100/125 VUs, 1002 complete and 11 interrupted iterations
warm_cache       ✓ [ 100% ] 25 VUs   2m0s
tabs_traffic_100   [  95% ] 100 VUs  3m47.3s/4m0s

running (5m49.0s), 100/125 VUs, 1006 complete and 11 interrupted iterations
warm_cache       ✓ [ 100% ] 25 VUs   2m0s
tabs_traffic_100   [  95% ] 100 VUs  3m48.3s/4m0s

running (5m50.0s), 100/125 VUs, 1009 complete and 11 interrupted iterations
warm_cache       ✓ [ 100% ] 25 VUs   2m0s
tabs_traffic_100   [  96% ] 100 VUs  3m49.3s/4m0s

running (5m51.0s), 100/125 VUs, 1011 complete and 11 interrupted iterations
warm_cache       ✓ [ 100% ] 25 VUs   2m0s
tabs_traffic_100   [  96% ] 100 VUs  3m50.3s/4m0s

running (5m52.0s), 100/125 VUs, 1016 complete and 11 interrupted iterations
warm_cache       ✓ [ 100% ] 25 VUs   2m0s
tabs_traffic_100   [  96% ] 100 VUs  3m51.3s/4m0s

running (5m53.0s), 100/125 VUs, 1019 complete and 11 interrupted iterations
warm_cache       ✓ [ 100% ] 25 VUs   2m0s
tabs_traffic_100   [  97% ] 100 VUs  3m52.3s/4m0s

running (5m54.0s), 100/125 VUs, 1022 complete and 11 interrupted iterations
warm_cache       ✓ [ 100% ] 25 VUs   2m0s
tabs_traffic_100   [  97% ] 100 VUs  3m53.3s/4m0s

running (5m55.0s), 100/125 VUs, 1023 complete and 11 interrupted iterations
warm_cache       ✓ [ 100% ] 25 VUs   2m0s
tabs_traffic_100   [  98% ] 100 VUs  3m54.3s/4m0s

running (5m56.0s), 100/125 VUs, 1028 complete and 11 interrupted iterations
warm_cache       ✓ [ 100% ] 25 VUs   2m0s
tabs_traffic_100   [  98% ] 100 VUs  3m55.3s/4m0s

running (5m57.0s), 100/125 VUs, 1031 complete and 11 interrupted iterations
warm_cache       ✓ [ 100% ] 25 VUs   2m0s
tabs_traffic_100   [  98% ] 100 VUs  3m56.3s/4m0s

running (5m58.0s), 100/125 VUs, 1035 complete and 11 interrupted iterations
warm_cache       ✓ [ 100% ] 25 VUs   2m0s
tabs_traffic_100   [  99% ] 100 VUs  3m57.3s/4m0s

running (5m59.0s), 100/125 VUs, 1037 complete and 11 interrupted iterations
warm_cache       ✓ [ 100% ] 25 VUs   2m0s
tabs_traffic_100   [  99% ] 100 VUs  3m58.3s/4m0s

running (6m00.0s), 100/125 VUs, 1042 complete and 11 interrupted iterations
warm_cache       ✓ [ 100% ] 25 VUs   2m0s
tabs_traffic_100   [ 100% ] 100 VUs  3m59.3s/4m0s

running (6m01.0s), 100/125 VUs, 1046 complete and 11 interrupted iterations
warm_cache       ✓ [ 100% ] 25 VUs   2m0s
tabs_traffic_100 ↓ [ 100% ] 100 VUs  4m0s

running (6m02.0s), 095/125 VUs, 1051 complete and 11 interrupted iterations
warm_cache       ✓ [ 100% ] 25 VUs   2m0s
tabs_traffic_100 ↓ [ 100% ] 100 VUs  4m0s

running (6m03.0s), 093/125 VUs, 1053 complete and 11 interrupted iterations
warm_cache       ✓ [ 100% ] 25 VUs   2m0s
tabs_traffic_100 ↓ [ 100% ] 100 VUs  4m0s

running (6m04.0s), 083/125 VUs, 1063 complete and 11 interrupted iterations
warm_cache       ✓ [ 100% ] 25 VUs   2m0s
tabs_traffic_100 ↓ [ 100% ] 100 VUs  4m0s

running (6m05.0s), 078/125 VUs, 1068 complete and 11 interrupted iterations
warm_cache       ✓ [ 100% ] 25 VUs   2m0s
tabs_traffic_100 ↓ [ 100% ] 100 VUs  4m0s

running (6m06.0s), 070/125 VUs, 1076 complete and 11 interrupted iterations
warm_cache       ✓ [ 100% ] 25 VUs   2m0s
tabs_traffic_100 ↓ [ 100% ] 100 VUs  4m0s

running (6m07.0s), 066/125 VUs, 1080 complete and 11 interrupted iterations
warm_cache       ✓ [ 100% ] 25 VUs   2m0s
tabs_traffic_100 ↓ [ 100% ] 100 VUs  4m0s

running (6m08.0s), 057/125 VUs, 1089 complete and 11 interrupted iterations
warm_cache       ✓ [ 100% ] 25 VUs   2m0s
tabs_traffic_100 ↓ [ 100% ] 100 VUs  4m0s

running (6m09.0s), 054/125 VUs, 1092 complete and 11 interrupted iterations
warm_cache       ✓ [ 100% ] 25 VUs   2m0s
tabs_traffic_100 ↓ [ 100% ] 100 VUs  4m0s

running (6m10.0s), 051/125 VUs, 1095 complete and 11 interrupted iterations
warm_cache       ✓ [ 100% ] 25 VUs   2m0s
tabs_traffic_100 ↓ [ 100% ] 100 VUs  4m0s

running (6m11.0s), 047/125 VUs, 1099 complete and 11 interrupted iterations
warm_cache       ✓ [ 100% ] 25 VUs   2m0s
tabs_traffic_100 ↓ [ 100% ] 100 VUs  4m0s

running (6m12.0s), 042/125 VUs, 1104 complete and 11 interrupted iterations
warm_cache       ✓ [ 100% ] 25 VUs   2m0s
tabs_traffic_100 ↓ [ 100% ] 100 VUs  4m0s

running (6m13.0s), 038/125 VUs, 1108 complete and 11 interrupted iterations
warm_cache       ✓ [ 100% ] 25 VUs   2m0s
tabs_traffic_100 ↓ [ 100% ] 100 VUs  4m0s

running (6m14.0s), 035/125 VUs, 1111 complete and 11 interrupted iterations
warm_cache       ✓ [ 100% ] 25 VUs   2m0s
tabs_traffic_100 ↓ [ 100% ] 100 VUs  4m0s

running (6m15.0s), 034/125 VUs, 1112 complete and 11 interrupted iterations
warm_cache       ✓ [ 100% ] 25 VUs   2m0s
tabs_traffic_100 ↓ [ 100% ] 100 VUs  4m0s

running (6m16.0s), 029/125 VUs, 1117 complete and 11 interrupted iterations
warm_cache       ✓ [ 100% ] 25 VUs   2m0s
tabs_traffic_100 ↓ [ 100% ] 100 VUs  4m0s

running (6m17.0s), 024/125 VUs, 1122 complete and 11 interrupted iterations
warm_cache       ✓ [ 100% ] 25 VUs   2m0s
tabs_traffic_100 ↓ [ 100% ] 100 VUs  4m0s

running (6m18.0s), 017/125 VUs, 1129 complete and 11 interrupted iterations
warm_cache       ✓ [ 100% ] 25 VUs   2m0s
tabs_traffic_100 ↓ [ 100% ] 100 VUs  4m0s

running (6m19.0s), 013/125 VUs, 1133 complete and 11 interrupted iterations
warm_cache       ✓ [ 100% ] 25 VUs   2m0s
tabs_traffic_100 ↓ [ 100% ] 100 VUs  4m0s

running (6m20.0s), 009/125 VUs, 1137 complete and 11 interrupted iterations
warm_cache       ✓ [ 100% ] 25 VUs   2m0s
tabs_traffic_100 ↓ [ 100% ] 100 VUs  4m0s

running (6m21.0s), 005/125 VUs, 1141 complete and 11 interrupted iterations
warm_cache       ✓ [ 100% ] 25 VUs   2m0s
tabs_traffic_100 ↓ [ 100% ] 100 VUs  4m0s

running (6m22.0s), 003/125 VUs, 1143 complete and 11 interrupted iterations
warm_cache       ✓ [ 100% ] 25 VUs   2m0s
tabs_traffic_100 ↓ [ 100% ] 100 VUs  4m0s

running (6m23.0s), 001/125 VUs, 1145 complete and 11 interrupted iterations
warm_cache       ✓ [ 100% ] 25 VUs   2m0s
tabs_traffic_100 ↓ [ 100% ] 100 VUs  4m0s

running (6m24.0s), 001/125 VUs, 1145 complete and 11 interrupted iterations
warm_cache       ✓ [ 100% ] 25 VUs   2m0s
tabs_traffic_100 ↓ [ 100% ] 100 VUs  4m0s

running (6m25.0s), 001/125 VUs, 1145 complete and 11 interrupted iterations
warm_cache       ✓ [ 100% ] 25 VUs   2m0s
tabs_traffic_100 ↓ [ 100% ] 100 VUs  4m0s

running (6m26.0s), 001/125 VUs, 1145 complete and 11 interrupted iterations
warm_cache       ✓ [ 100% ] 25 VUs   2m0s
tabs_traffic_100 ↓ [ 100% ] 100 VUs  4m0s

running (6m27.0s), 001/125 VUs, 1145 complete and 11 interrupted iterations
warm_cache       ✓ [ 100% ] 25 VUs   2m0s
tabs_traffic_100 ↓ [ 100% ] 100 VUs  4m0s

running (6m28.0s), 001/125 VUs, 1145 complete and 11 interrupted iterations
warm_cache       ✓ [ 100% ] 25 VUs   2m0s
tabs_traffic_100 ↓ [ 100% ] 100 VUs  4m0s

running (6m29.0s), 001/125 VUs, 1145 complete and 11 interrupted iterations
warm_cache       ✓ [ 100% ] 25 VUs   2m0s
tabs_traffic_100 ↓ [ 100% ] 100 VUs  4m0s


  █ THRESHOLDS 

    html_duration
    ✗ 'p(95)<1700' p(95)=6.53s

    http_req_duration
    ✗ 'p(95)<1800' p(95)=6.52s
    ✗ 'p(99)<3200' p(99)=8.94s

    http_req_failed
    ✓ 'rate<0.02' rate=0.00%

    server_error_rate
    ✓ 'rate<0.01' rate=0.00%

    throttled_rate
    ✓ 'rate<0.03' rate=0.00%


  █ TOTAL RESULTS 

    checks_total.......: 17007   43.669489/s
    checks_succeeded...: 100.00% 17007 out of 17007
    checks_failed......: 0.00%   0 out of 17007

    ✓ warm: status 200/304
    ✓ main: html status 200/304
    ✓ main: no throttle
    ✓ back: status 200/304

    CUSTOM
    html_duration..................: avg=1.87s  min=79.76ms med=1.03s  max=36.01s p(90)=5.48s p(95)=6.53s 
    server_error_rate..............: 0.00%  0 out of 10744
    throttled_rate.................: 0.00%  0 out of 10744

    HTTP
    http_req_duration..............: avg=1.87s  min=79.76ms med=1.03s  max=36.01s p(90)=5.48s p(95)=6.52s 
      { expected_response:true }...: avg=1.87s  min=79.76ms med=1.03s  max=36.01s p(90)=5.48s p(95)=6.52s 
    http_req_failed................: 0.00%  0 out of 10747
    http_reqs......................: 10747  27.595461/s

    EXECUTION
    iteration_duration.............: avg=24.52s min=4.49s   med=22.69s max=1m39s  p(90)=38.8s p(95)=44.27s
    iterations.....................: 1146   2.942626/s
    vus............................: 1      min=1          max=125
    vus_max........................: 125    min=125        max=125

    NETWORK
    data_received..................: 818 MB 2.1 MB/s
    data_sent......................: 5.5 MB 14 kB/s




running (6m29.4s), 000/125 VUs, 1146 complete and 11 interrupted iterations
warm_cache       ✓ [ 100% ] 25 VUs   2m0s
tabs_traffic_100 ✓ [ 100% ] 100 VUs  4m0s
