
         /\      Grafana   /‾‾/  
    /\  /  \     |\  __   /  /   
   /  \/    \    | |/ /  /   ‾‾\ 
  /          \   |   (  |  (‾)  |
 / __________ \  |_|\_\  \_____/ 


     execution: local
        script: tests/k6/vercel-tabs-cache.js
        output: -

     scenarios: (100.00%) 2 scenarios, 125 max VUs, 6m30s max duration (incl. graceful stop):
              * warm_cache: 25 looping VUs for 2m0s (exec: warmCache, gracefulStop: 30s)
              * tabs_traffic_100: 100 looping VUs for 4m0s (exec: tabsTraffic, startTime: 2m0s, gracefulStop: 30s)


running (0m01.0s), 025/125 VUs, 0 complete and 0 interrupted iterations
warm_cache         [   0% ] 25 VUs   0m00.2s/2m0s
tabs_traffic_100 • [   0% ] waiting  1m59.8s

running (0m02.0s), 025/125 VUs, 0 complete and 0 interrupted iterations
warm_cache         [   1% ] 25 VUs   0m01.2s/2m0s
tabs_traffic_100 • [   0% ] waiting  1m58.8s

running (0m03.0s), 025/125 VUs, 0 complete and 0 interrupted iterations
warm_cache         [   2% ] 25 VUs   0m02.2s/2m0s
tabs_traffic_100 • [   0% ] waiting  1m57.8s

running (0m04.0s), 025/125 VUs, 0 complete and 0 interrupted iterations
warm_cache         [   3% ] 25 VUs   0m03.2s/2m0s
tabs_traffic_100 • [   0% ] waiting  1m56.8s

running (0m05.0s), 025/125 VUs, 0 complete and 0 interrupted iterations
warm_cache         [   3% ] 25 VUs   0m04.2s/2m0s
tabs_traffic_100 • [   0% ] waiting  1m55.8s

running (0m06.0s), 025/125 VUs, 0 complete and 0 interrupted iterations
warm_cache         [   4% ] 25 VUs   0m05.2s/2m0s
tabs_traffic_100 • [   0% ] waiting  1m54.8s

running (0m07.0s), 025/125 VUs, 0 complete and 0 interrupted iterations
warm_cache         [   5% ] 25 VUs   0m06.2s/2m0s
tabs_traffic_100 • [   0% ] waiting  1m53.8s

running (0m08.0s), 025/125 VUs, 0 complete and 0 interrupted iterations
warm_cache         [   6% ] 25 VUs   0m07.2s/2m0s
tabs_traffic_100 • [   0% ] waiting  1m52.8s

running (0m09.0s), 025/125 VUs, 0 complete and 0 interrupted iterations
warm_cache         [   7% ] 25 VUs   0m08.2s/2m0s
tabs_traffic_100 • [   0% ] waiting  1m51.8s

running (0m10.0s), 025/125 VUs, 0 complete and 0 interrupted iterations
warm_cache         [   8% ] 25 VUs   0m09.2s/2m0s
tabs_traffic_100 • [   0% ] waiting  1m50.8s

running (0m11.0s), 025/125 VUs, 0 complete and 0 interrupted iterations
warm_cache         [   8% ] 25 VUs   0m10.2s/2m0s
tabs_traffic_100 • [   0% ] waiting  1m49.8s

running (0m12.0s), 025/125 VUs, 0 complete and 0 interrupted iterations
warm_cache         [   9% ] 25 VUs   0m11.2s/2m0s
tabs_traffic_100 • [   0% ] waiting  1m48.8s

running (0m13.0s), 025/125 VUs, 0 complete and 0 interrupted iterations
warm_cache         [  10% ] 25 VUs   0m12.2s/2m0s
tabs_traffic_100 • [   0% ] waiting  1m47.8s

running (0m14.0s), 025/125 VUs, 2 complete and 0 interrupted iterations
warm_cache         [  11% ] 25 VUs   0m13.2s/2m0s
tabs_traffic_100 • [   0% ] waiting  1m46.8s

running (0m15.0s), 025/125 VUs, 2 complete and 0 interrupted iterations
warm_cache         [  12% ] 25 VUs   0m14.2s/2m0s
tabs_traffic_100 • [   0% ] waiting  1m45.8s

running (0m16.0s), 025/125 VUs, 3 complete and 0 interrupted iterations
warm_cache         [  13% ] 25 VUs   0m15.2s/2m0s
tabs_traffic_100 • [   0% ] waiting  1m44.8s

running (0m17.0s), 025/125 VUs, 5 complete and 0 interrupted iterations
warm_cache         [  13% ] 25 VUs   0m16.2s/2m0s
tabs_traffic_100 • [   0% ] waiting  1m43.8s

running (0m18.0s), 025/125 VUs, 7 complete and 0 interrupted iterations
warm_cache         [  14% ] 25 VUs   0m17.2s/2m0s
tabs_traffic_100 • [   0% ] waiting  1m42.8s

running (0m19.0s), 025/125 VUs, 8 complete and 0 interrupted iterations
warm_cache         [  15% ] 25 VUs   0m18.2s/2m0s
tabs_traffic_100 • [   0% ] waiting  1m41.8s

running (0m20.0s), 025/125 VUs, 10 complete and 0 interrupted iterations
warm_cache         [  16% ] 25 VUs   0m19.2s/2m0s
tabs_traffic_100 • [   0% ] waiting  1m40.8s

running (0m21.0s), 025/125 VUs, 10 complete and 0 interrupted iterations
warm_cache         [  17% ] 25 VUs   0m20.2s/2m0s
tabs_traffic_100 • [   0% ] waiting  1m39.8s

running (0m22.0s), 025/125 VUs, 10 complete and 0 interrupted iterations
warm_cache         [  18% ] 25 VUs   0m21.2s/2m0s
tabs_traffic_100 • [   0% ] waiting  1m38.8s

running (0m23.0s), 025/125 VUs, 11 complete and 0 interrupted iterations
warm_cache         [  18% ] 25 VUs   0m22.2s/2m0s
tabs_traffic_100 • [   0% ] waiting  1m37.8s

running (0m24.0s), 025/125 VUs, 11 complete and 0 interrupted iterations
warm_cache         [  19% ] 25 VUs   0m23.2s/2m0s
tabs_traffic_100 • [   0% ] waiting  1m36.8s

running (0m25.0s), 025/125 VUs, 11 complete and 0 interrupted iterations
warm_cache         [  20% ] 25 VUs   0m24.2s/2m0s
tabs_traffic_100 • [   0% ] waiting  1m35.8s

running (0m26.0s), 025/125 VUs, 11 complete and 0 interrupted iterations
warm_cache         [  21% ] 25 VUs   0m25.2s/2m0s
tabs_traffic_100 • [   0% ] waiting  1m34.8s

running (0m27.0s), 025/125 VUs, 12 complete and 0 interrupted iterations
warm_cache         [  22% ] 25 VUs   0m26.2s/2m0s
tabs_traffic_100 • [   0% ] waiting  1m33.8s

running (0m28.0s), 025/125 VUs, 13 complete and 0 interrupted iterations
warm_cache         [  23% ] 25 VUs   0m27.2s/2m0s
tabs_traffic_100 • [   0% ] waiting  1m32.8s

running (0m29.0s), 025/125 VUs, 13 complete and 0 interrupted iterations
warm_cache         [  23% ] 25 VUs   0m28.2s/2m0s
tabs_traffic_100 • [   0% ] waiting  1m31.8s

running (0m30.0s), 025/125 VUs, 14 complete and 0 interrupted iterations
warm_cache         [  24% ] 25 VUs   0m29.2s/2m0s
tabs_traffic_100 • [   0% ] waiting  1m30.8s

running (0m31.0s), 025/125 VUs, 15 complete and 0 interrupted iterations
warm_cache         [  25% ] 25 VUs   0m30.2s/2m0s
tabs_traffic_100 • [   0% ] waiting  1m29.8s

running (0m32.0s), 025/125 VUs, 16 complete and 0 interrupted iterations
warm_cache         [  26% ] 25 VUs   0m31.2s/2m0s
tabs_traffic_100 • [   0% ] waiting  1m28.8s

running (0m33.0s), 025/125 VUs, 16 complete and 0 interrupted iterations
warm_cache         [  27% ] 25 VUs   0m32.2s/2m0s
tabs_traffic_100 • [   0% ] waiting  1m27.8s

running (0m34.0s), 025/125 VUs, 18 complete and 0 interrupted iterations
warm_cache         [  28% ] 25 VUs   0m33.2s/2m0s
tabs_traffic_100 • [   0% ] waiting  1m26.8s

running (0m35.0s), 025/125 VUs, 19 complete and 0 interrupted iterations
warm_cache         [  28% ] 25 VUs   0m34.2s/2m0s
tabs_traffic_100 • [   0% ] waiting  1m25.8s

running (0m36.0s), 025/125 VUs, 21 complete and 0 interrupted iterations
warm_cache         [  29% ] 25 VUs   0m35.2s/2m0s
tabs_traffic_100 • [   0% ] waiting  1m24.8s

running (0m37.0s), 025/125 VUs, 22 complete and 0 interrupted iterations
warm_cache         [  30% ] 25 VUs   0m36.2s/2m0s
tabs_traffic_100 • [   0% ] waiting  1m23.8s

running (0m38.0s), 025/125 VUs, 22 complete and 0 interrupted iterations
warm_cache         [  31% ] 25 VUs   0m37.2s/2m0s
tabs_traffic_100 • [   0% ] waiting  1m22.8s

running (0m39.0s), 025/125 VUs, 23 complete and 0 interrupted iterations
warm_cache         [  32% ] 25 VUs   0m38.2s/2m0s
tabs_traffic_100 • [   0% ] waiting  1m21.8s

running (0m40.0s), 025/125 VUs, 25 complete and 0 interrupted iterations
warm_cache         [  33% ] 25 VUs   0m39.2s/2m0s
tabs_traffic_100 • [   0% ] waiting  1m20.8s

running (0m41.0s), 025/125 VUs, 25 complete and 0 interrupted iterations
warm_cache         [  33% ] 25 VUs   0m40.2s/2m0s
tabs_traffic_100 • [   0% ] waiting  1m19.8s

running (0m42.0s), 025/125 VUs, 27 complete and 0 interrupted iterations
warm_cache         [  34% ] 25 VUs   0m41.2s/2m0s
tabs_traffic_100 • [   0% ] waiting  1m18.8s

running (0m43.0s), 025/125 VUs, 27 complete and 0 interrupted iterations
warm_cache         [  35% ] 25 VUs   0m42.2s/2m0s
tabs_traffic_100 • [   0% ] waiting  1m17.8s

running (0m44.0s), 025/125 VUs, 28 complete and 0 interrupted iterations
warm_cache         [  36% ] 25 VUs   0m43.2s/2m0s
tabs_traffic_100 • [   0% ] waiting  1m16.8s

running (0m45.0s), 025/125 VUs, 28 complete and 0 interrupted iterations
warm_cache         [  37% ] 25 VUs   0m44.2s/2m0s
tabs_traffic_100 • [   0% ] waiting  1m15.8s

running (0m46.0s), 025/125 VUs, 28 complete and 0 interrupted iterations
warm_cache         [  38% ] 25 VUs   0m45.2s/2m0s
tabs_traffic_100 • [   0% ] waiting  1m14.8s

running (0m47.0s), 025/125 VUs, 28 complete and 0 interrupted iterations
warm_cache         [  38% ] 25 VUs   0m46.2s/2m0s
tabs_traffic_100 • [   0% ] waiting  1m13.8s

running (0m48.0s), 025/125 VUs, 31 complete and 0 interrupted iterations
warm_cache         [  39% ] 25 VUs   0m47.2s/2m0s
tabs_traffic_100 • [   0% ] waiting  1m12.8s

running (0m49.0s), 025/125 VUs, 32 complete and 0 interrupted iterations
warm_cache         [  40% ] 25 VUs   0m48.2s/2m0s
tabs_traffic_100 • [   0% ] waiting  1m11.8s

running (0m50.0s), 025/125 VUs, 33 complete and 0 interrupted iterations
warm_cache         [  41% ] 25 VUs   0m49.2s/2m0s
tabs_traffic_100 • [   0% ] waiting  1m10.8s

running (0m51.0s), 025/125 VUs, 34 complete and 0 interrupted iterations
warm_cache         [  42% ] 25 VUs   0m50.2s/2m0s
tabs_traffic_100 • [   0% ] waiting  1m09.8s

running (0m52.0s), 025/125 VUs, 35 complete and 0 interrupted iterations
warm_cache         [  43% ] 25 VUs   0m51.2s/2m0s
tabs_traffic_100 • [   0% ] waiting  1m08.8s

running (0m53.0s), 025/125 VUs, 37 complete and 0 interrupted iterations
warm_cache         [  43% ] 25 VUs   0m52.2s/2m0s
tabs_traffic_100 • [   0% ] waiting  1m07.8s

running (0m54.0s), 025/125 VUs, 38 complete and 0 interrupted iterations
warm_cache         [  44% ] 25 VUs   0m53.2s/2m0s
tabs_traffic_100 • [   0% ] waiting  1m06.8s

running (0m55.0s), 025/125 VUs, 39 complete and 0 interrupted iterations
warm_cache         [  45% ] 25 VUs   0m54.2s/2m0s
tabs_traffic_100 • [   0% ] waiting  1m05.8s

running (0m56.0s), 025/125 VUs, 41 complete and 0 interrupted iterations
warm_cache         [  46% ] 25 VUs   0m55.2s/2m0s
tabs_traffic_100 • [   0% ] waiting  1m04.8s

running (0m57.0s), 025/125 VUs, 41 complete and 0 interrupted iterations
warm_cache         [  47% ] 25 VUs   0m56.2s/2m0s
tabs_traffic_100 • [   0% ] waiting  1m03.8s

running (0m58.0s), 025/125 VUs, 42 complete and 0 interrupted iterations
warm_cache         [  48% ] 25 VUs   0m57.2s/2m0s
tabs_traffic_100 • [   0% ] waiting  1m02.8s

running (0m59.0s), 025/125 VUs, 42 complete and 0 interrupted iterations
warm_cache         [  48% ] 25 VUs   0m58.2s/2m0s
tabs_traffic_100 • [   0% ] waiting  1m01.8s

running (1m00.0s), 025/125 VUs, 42 complete and 0 interrupted iterations
warm_cache         [  49% ] 25 VUs   0m59.2s/2m0s
tabs_traffic_100 • [   0% ] waiting  1m00.8s

running (1m01.0s), 025/125 VUs, 43 complete and 0 interrupted iterations
warm_cache         [  50% ] 25 VUs   1m00.2s/2m0s
tabs_traffic_100 • [   0% ] waiting  0m59.8s

running (1m02.0s), 025/125 VUs, 44 complete and 0 interrupted iterations
warm_cache         [  51% ] 25 VUs   1m01.2s/2m0s
tabs_traffic_100 • [   0% ] waiting  0m58.8s

running (1m03.0s), 025/125 VUs, 44 complete and 0 interrupted iterations
warm_cache         [  52% ] 25 VUs   1m02.2s/2m0s
tabs_traffic_100 • [   0% ] waiting  0m57.8s

running (1m04.0s), 025/125 VUs, 45 complete and 0 interrupted iterations
warm_cache         [  53% ] 25 VUs   1m03.2s/2m0s
tabs_traffic_100 • [   0% ] waiting  0m56.8s

running (1m05.0s), 025/125 VUs, 45 complete and 0 interrupted iterations
warm_cache         [  53% ] 25 VUs   1m04.2s/2m0s
tabs_traffic_100 • [   0% ] waiting  0m55.8s

running (1m06.0s), 025/125 VUs, 47 complete and 0 interrupted iterations
warm_cache         [  54% ] 25 VUs   1m05.2s/2m0s
tabs_traffic_100 • [   0% ] waiting  0m54.8s

running (1m07.0s), 025/125 VUs, 48 complete and 0 interrupted iterations
warm_cache         [  55% ] 25 VUs   1m06.2s/2m0s
tabs_traffic_100 • [   0% ] waiting  0m53.8s

running (1m08.0s), 025/125 VUs, 48 complete and 0 interrupted iterations
warm_cache         [  56% ] 25 VUs   1m07.2s/2m0s
tabs_traffic_100 • [   0% ] waiting  0m52.8s

running (1m09.0s), 025/125 VUs, 49 complete and 0 interrupted iterations
warm_cache         [  57% ] 25 VUs   1m08.2s/2m0s
tabs_traffic_100 • [   0% ] waiting  0m51.8s

running (1m10.0s), 025/125 VUs, 49 complete and 0 interrupted iterations
warm_cache         [  58% ] 25 VUs   1m09.2s/2m0s
tabs_traffic_100 • [   0% ] waiting  0m50.8s

running (1m11.0s), 025/125 VUs, 51 complete and 0 interrupted iterations
warm_cache         [  58% ] 25 VUs   1m10.2s/2m0s
tabs_traffic_100 • [   0% ] waiting  0m49.8s

running (1m12.0s), 025/125 VUs, 51 complete and 0 interrupted iterations
warm_cache         [  59% ] 25 VUs   1m11.2s/2m0s
tabs_traffic_100 • [   0% ] waiting  0m48.8s

running (1m13.0s), 025/125 VUs, 53 complete and 0 interrupted iterations
warm_cache         [  60% ] 25 VUs   1m12.2s/2m0s
tabs_traffic_100 • [   0% ] waiting  0m47.8s

running (1m14.0s), 025/125 VUs, 54 complete and 0 interrupted iterations
warm_cache         [  61% ] 25 VUs   1m13.2s/2m0s
tabs_traffic_100 • [   0% ] waiting  0m46.8s

running (1m15.0s), 025/125 VUs, 54 complete and 0 interrupted iterations
warm_cache         [  62% ] 25 VUs   1m14.2s/2m0s
tabs_traffic_100 • [   0% ] waiting  0m45.8s

running (1m16.0s), 025/125 VUs, 56 complete and 0 interrupted iterations
warm_cache         [  63% ] 25 VUs   1m15.2s/2m0s
tabs_traffic_100 • [   0% ] waiting  0m44.8s

running (1m17.0s), 025/125 VUs, 58 complete and 0 interrupted iterations
warm_cache         [  63% ] 25 VUs   1m16.2s/2m0s
tabs_traffic_100 • [   0% ] waiting  0m43.8s

running (1m18.0s), 025/125 VUs, 58 complete and 0 interrupted iterations
warm_cache         [  64% ] 25 VUs   1m17.2s/2m0s
tabs_traffic_100 • [   0% ] waiting  0m42.8s

running (1m19.0s), 025/125 VUs, 59 complete and 0 interrupted iterations
warm_cache         [  65% ] 25 VUs   1m18.2s/2m0s
tabs_traffic_100 • [   0% ] waiting  0m41.8s

running (1m20.0s), 025/125 VUs, 59 complete and 0 interrupted iterations
warm_cache         [  66% ] 25 VUs   1m19.2s/2m0s
tabs_traffic_100 • [   0% ] waiting  0m40.8s

running (1m21.0s), 025/125 VUs, 60 complete and 0 interrupted iterations
warm_cache         [  67% ] 25 VUs   1m20.2s/2m0s
tabs_traffic_100 • [   0% ] waiting  0m39.8s

running (1m22.0s), 025/125 VUs, 62 complete and 0 interrupted iterations
warm_cache         [  68% ] 25 VUs   1m21.2s/2m0s
tabs_traffic_100 • [   0% ] waiting  0m38.8s

running (1m23.0s), 025/125 VUs, 62 complete and 0 interrupted iterations
warm_cache         [  68% ] 25 VUs   1m22.2s/2m0s
tabs_traffic_100 • [   0% ] waiting  0m37.8s

running (1m24.0s), 025/125 VUs, 62 complete and 0 interrupted iterations
warm_cache         [  69% ] 25 VUs   1m23.2s/2m0s
tabs_traffic_100 • [   0% ] waiting  0m36.8s

running (1m25.0s), 025/125 VUs, 62 complete and 0 interrupted iterations
warm_cache         [  70% ] 25 VUs   1m24.2s/2m0s
tabs_traffic_100 • [   0% ] waiting  0m35.8s

running (1m26.0s), 025/125 VUs, 63 complete and 0 interrupted iterations
warm_cache         [  71% ] 25 VUs   1m25.2s/2m0s
tabs_traffic_100 • [   0% ] waiting  0m34.8s

running (1m27.0s), 025/125 VUs, 64 complete and 0 interrupted iterations
warm_cache         [  72% ] 25 VUs   1m26.2s/2m0s
tabs_traffic_100 • [   0% ] waiting  0m33.8s

running (1m28.0s), 025/125 VUs, 67 complete and 0 interrupted iterations
warm_cache         [  73% ] 25 VUs   1m27.2s/2m0s
tabs_traffic_100 • [   0% ] waiting  0m32.8s

running (1m29.0s), 025/125 VUs, 68 complete and 0 interrupted iterations
warm_cache         [  73% ] 25 VUs   1m28.2s/2m0s
tabs_traffic_100 • [   0% ] waiting  0m31.8s

running (1m30.0s), 025/125 VUs, 69 complete and 0 interrupted iterations
warm_cache         [  74% ] 25 VUs   1m29.2s/2m0s
tabs_traffic_100 • [   0% ] waiting  0m30.8s

running (1m31.0s), 025/125 VUs, 70 complete and 0 interrupted iterations
warm_cache         [  75% ] 25 VUs   1m30.2s/2m0s
tabs_traffic_100 • [   0% ] waiting  0m29.8s

running (1m32.0s), 025/125 VUs, 71 complete and 0 interrupted iterations
warm_cache         [  76% ] 25 VUs   1m31.2s/2m0s
tabs_traffic_100 • [   0% ] waiting  0m28.8s

running (1m33.0s), 025/125 VUs, 72 complete and 0 interrupted iterations
warm_cache         [  77% ] 25 VUs   1m32.2s/2m0s
tabs_traffic_100 • [   0% ] waiting  0m27.8s

running (1m34.0s), 025/125 VUs, 72 complete and 0 interrupted iterations
warm_cache         [  78% ] 25 VUs   1m33.2s/2m0s
tabs_traffic_100 • [   0% ] waiting  0m26.8s

running (1m35.0s), 025/125 VUs, 72 complete and 0 interrupted iterations
warm_cache         [  78% ] 25 VUs   1m34.2s/2m0s
tabs_traffic_100 • [   0% ] waiting  0m25.8s

running (1m36.0s), 025/125 VUs, 73 complete and 0 interrupted iterations
warm_cache         [  79% ] 25 VUs   1m35.2s/2m0s
tabs_traffic_100 • [   0% ] waiting  0m24.8s

running (1m37.0s), 025/125 VUs, 76 complete and 0 interrupted iterations
warm_cache         [  80% ] 25 VUs   1m36.2s/2m0s
tabs_traffic_100 • [   0% ] waiting  0m23.8s

running (1m38.0s), 025/125 VUs, 76 complete and 0 interrupted iterations
warm_cache         [  81% ] 25 VUs   1m37.2s/2m0s
tabs_traffic_100 • [   0% ] waiting  0m22.8s

running (1m39.0s), 025/125 VUs, 76 complete and 0 interrupted iterations
warm_cache         [  82% ] 25 VUs   1m38.2s/2m0s
tabs_traffic_100 • [   0% ] waiting  0m21.8s

running (1m40.0s), 025/125 VUs, 77 complete and 0 interrupted iterations
warm_cache         [  83% ] 25 VUs   1m39.2s/2m0s
tabs_traffic_100 • [   0% ] waiting  0m20.8s

running (1m41.0s), 025/125 VUs, 77 complete and 0 interrupted iterations
warm_cache         [  83% ] 25 VUs   1m40.2s/2m0s
tabs_traffic_100 • [   0% ] waiting  0m19.8s

running (1m42.0s), 025/125 VUs, 77 complete and 0 interrupted iterations
warm_cache         [  84% ] 25 VUs   1m41.2s/2m0s
tabs_traffic_100 • [   0% ] waiting  0m18.8s

running (1m43.0s), 025/125 VUs, 77 complete and 0 interrupted iterations
warm_cache         [  85% ] 25 VUs   1m42.2s/2m0s
tabs_traffic_100 • [   0% ] waiting  0m17.8s

running (1m44.0s), 025/125 VUs, 77 complete and 0 interrupted iterations
warm_cache         [  86% ] 25 VUs   1m43.2s/2m0s
tabs_traffic_100 • [   0% ] waiting  0m16.8s

running (1m45.0s), 025/125 VUs, 78 complete and 0 interrupted iterations
warm_cache         [  87% ] 25 VUs   1m44.2s/2m0s
tabs_traffic_100 • [   0% ] waiting  0m15.8s

running (1m46.0s), 025/125 VUs, 79 complete and 0 interrupted iterations
warm_cache         [  88% ] 25 VUs   1m45.2s/2m0s
tabs_traffic_100 • [   0% ] waiting  0m14.8s

running (1m47.0s), 025/125 VUs, 81 complete and 0 interrupted iterations
warm_cache         [  88% ] 25 VUs   1m46.2s/2m0s
tabs_traffic_100 • [   0% ] waiting  0m13.8s

running (1m48.0s), 025/125 VUs, 82 complete and 0 interrupted iterations
warm_cache         [  89% ] 25 VUs   1m47.2s/2m0s
tabs_traffic_100 • [   0% ] waiting  0m12.8s

running (1m49.0s), 025/125 VUs, 82 complete and 0 interrupted iterations
warm_cache         [  90% ] 25 VUs   1m48.2s/2m0s
tabs_traffic_100 • [   0% ] waiting  0m11.8s

running (1m50.0s), 025/125 VUs, 83 complete and 0 interrupted iterations
warm_cache         [  91% ] 25 VUs   1m49.2s/2m0s
tabs_traffic_100 • [   0% ] waiting  0m10.8s

running (1m51.0s), 025/125 VUs, 85 complete and 0 interrupted iterations
warm_cache         [  92% ] 25 VUs   1m50.2s/2m0s
tabs_traffic_100 • [   0% ] waiting  0m09.8s

running (1m52.0s), 025/125 VUs, 87 complete and 0 interrupted iterations
warm_cache         [  93% ] 25 VUs   1m51.2s/2m0s
tabs_traffic_100 • [   0% ] waiting  0m08.8s

running (1m53.0s), 025/125 VUs, 88 complete and 0 interrupted iterations
warm_cache         [  93% ] 25 VUs   1m52.2s/2m0s
tabs_traffic_100 • [   0% ] waiting  0m07.8s

running (1m54.0s), 025/125 VUs, 88 complete and 0 interrupted iterations
warm_cache         [  94% ] 25 VUs   1m53.2s/2m0s
tabs_traffic_100 • [   0% ] waiting  0m06.8s

running (1m55.0s), 025/125 VUs, 90 complete and 0 interrupted iterations
warm_cache         [  95% ] 25 VUs   1m54.2s/2m0s
tabs_traffic_100 • [   0% ] waiting  0m05.8s

running (1m56.0s), 025/125 VUs, 90 complete and 0 interrupted iterations
warm_cache         [  96% ] 25 VUs   1m55.2s/2m0s
tabs_traffic_100 • [   0% ] waiting  0m04.8s

running (1m57.0s), 025/125 VUs, 90 complete and 0 interrupted iterations
warm_cache         [  97% ] 25 VUs   1m56.2s/2m0s
tabs_traffic_100 • [   0% ] waiting  0m03.8s

running (1m58.0s), 025/125 VUs, 90 complete and 0 interrupted iterations
warm_cache         [  98% ] 25 VUs   1m57.2s/2m0s
tabs_traffic_100 • [   0% ] waiting  0m02.8s

running (1m59.0s), 025/125 VUs, 90 complete and 0 interrupted iterations
warm_cache         [  98% ] 25 VUs   1m58.2s/2m0s
tabs_traffic_100 • [   0% ] waiting  0m01.8s

running (2m00.0s), 025/125 VUs, 90 complete and 0 interrupted iterations
warm_cache         [  99% ] 25 VUs   1m59.2s/2m0s
tabs_traffic_100 • [   0% ] waiting  0m00.8s

running (2m01.0s), 125/125 VUs, 91 complete and 0 interrupted iterations
warm_cache       ↓ [ 100% ] 25 VUs   2m0s
tabs_traffic_100   [   0% ] 100 VUs  0m00.2s/4m0s

running (2m02.0s), 124/125 VUs, 92 complete and 0 interrupted iterations
warm_cache       ↓ [ 100% ] 25 VUs   2m0s
tabs_traffic_100   [   0% ] 100 VUs  0m01.2s/4m0s

running (2m03.0s), 123/125 VUs, 93 complete and 0 interrupted iterations
warm_cache       ↓ [ 100% ] 25 VUs   2m0s
tabs_traffic_100   [   1% ] 100 VUs  0m02.2s/4m0s

running (2m04.0s), 123/125 VUs, 93 complete and 0 interrupted iterations
warm_cache       ↓ [ 100% ] 25 VUs   2m0s
tabs_traffic_100   [   1% ] 100 VUs  0m03.2s/4m0s

running (2m05.0s), 121/125 VUs, 96 complete and 0 interrupted iterations
warm_cache       ↓ [ 100% ] 25 VUs   2m0s
tabs_traffic_100   [   2% ] 100 VUs  0m04.2s/4m0s

running (2m06.0s), 121/125 VUs, 98 complete and 0 interrupted iterations
warm_cache       ↓ [ 100% ] 25 VUs   2m0s
tabs_traffic_100   [   2% ] 100 VUs  0m05.2s/4m0s

running (2m07.0s), 120/125 VUs, 100 complete and 0 interrupted iterations
warm_cache       ↓ [ 100% ] 25 VUs   2m0s
tabs_traffic_100   [   3% ] 100 VUs  0m06.2s/4m0s

running (2m08.0s), 120/125 VUs, 106 complete and 0 interrupted iterations
warm_cache       ↓ [ 100% ] 25 VUs   2m0s
tabs_traffic_100   [   3% ] 100 VUs  0m07.2s/4m0s

running (2m09.0s), 120/125 VUs, 106 complete and 0 interrupted iterations
warm_cache       ↓ [ 100% ] 25 VUs   2m0s
tabs_traffic_100   [   3% ] 100 VUs  0m08.2s/4m0s

running (2m10.0s), 118/125 VUs, 111 complete and 0 interrupted iterations
warm_cache       ↓ [ 100% ] 25 VUs   2m0s
tabs_traffic_100   [   4% ] 100 VUs  0m09.2s/4m0s

running (2m11.0s), 118/125 VUs, 112 complete and 0 interrupted iterations
warm_cache       ↓ [ 100% ] 25 VUs   2m0s
tabs_traffic_100   [   4% ] 100 VUs  0m10.2s/4m0s

running (2m12.0s), 116/125 VUs, 114 complete and 0 interrupted iterations
warm_cache       ↓ [ 100% ] 25 VUs   2m0s
tabs_traffic_100   [   5% ] 100 VUs  0m11.2s/4m0s

running (2m13.0s), 115/125 VUs, 117 complete and 0 interrupted iterations
warm_cache       ↓ [ 100% ] 25 VUs   2m0s
tabs_traffic_100   [   5% ] 100 VUs  0m12.2s/4m0s

running (2m14.0s), 115/125 VUs, 117 complete and 0 interrupted iterations
warm_cache       ↓ [ 100% ] 25 VUs   2m0s
tabs_traffic_100   [   5% ] 100 VUs  0m13.2s/4m0s

running (2m15.0s), 115/125 VUs, 120 complete and 0 interrupted iterations
warm_cache       ↓ [ 100% ] 25 VUs   2m0s
tabs_traffic_100   [   6% ] 100 VUs  0m14.2s/4m0s

running (2m16.0s), 115/125 VUs, 124 complete and 0 interrupted iterations
warm_cache       ↓ [ 100% ] 25 VUs   2m0s
tabs_traffic_100   [   6% ] 100 VUs  0m15.2s/4m0s

running (2m17.0s), 115/125 VUs, 127 complete and 0 interrupted iterations
warm_cache       ↓ [ 100% ] 25 VUs   2m0s
tabs_traffic_100   [   7% ] 100 VUs  0m16.2s/4m0s

running (2m18.0s), 115/125 VUs, 133 complete and 0 interrupted iterations
warm_cache       ↓ [ 100% ] 25 VUs   2m0s
tabs_traffic_100   [   7% ] 100 VUs  0m17.2s/4m0s

running (2m19.0s), 115/125 VUs, 139 complete and 0 interrupted iterations
warm_cache       ↓ [ 100% ] 25 VUs   2m0s
tabs_traffic_100   [   8% ] 100 VUs  0m18.2s/4m0s

running (2m20.0s), 114/125 VUs, 141 complete and 0 interrupted iterations
warm_cache       ↓ [ 100% ] 25 VUs   2m0s
tabs_traffic_100   [   8% ] 100 VUs  0m19.2s/4m0s

running (2m21.0s), 114/125 VUs, 145 complete and 0 interrupted iterations
warm_cache       ↓ [ 100% ] 25 VUs   2m0s
tabs_traffic_100   [   8% ] 100 VUs  0m20.2s/4m0s

running (2m22.0s), 113/125 VUs, 150 complete and 0 interrupted iterations
warm_cache       ↓ [ 100% ] 25 VUs   2m0s
tabs_traffic_100   [   9% ] 100 VUs  0m21.2s/4m0s

running (2m23.0s), 113/125 VUs, 155 complete and 0 interrupted iterations
warm_cache       ↓ [ 100% ] 25 VUs   2m0s
tabs_traffic_100   [   9% ] 100 VUs  0m22.2s/4m0s

running (2m24.0s), 113/125 VUs, 161 complete and 0 interrupted iterations
warm_cache       ↓ [ 100% ] 25 VUs   2m0s
tabs_traffic_100   [  10% ] 100 VUs  0m23.2s/4m0s

running (2m25.0s), 113/125 VUs, 168 complete and 0 interrupted iterations
warm_cache       ↓ [ 100% ] 25 VUs   2m0s
tabs_traffic_100   [  10% ] 100 VUs  0m24.2s/4m0s

running (2m26.0s), 113/125 VUs, 172 complete and 0 interrupted iterations
warm_cache       ↓ [ 100% ] 25 VUs   2m0s
tabs_traffic_100   [  10% ] 100 VUs  0m25.2s/4m0s

running (2m27.0s), 113/125 VUs, 177 complete and 0 interrupted iterations
warm_cache       ↓ [ 100% ] 25 VUs   2m0s
tabs_traffic_100   [  11% ] 100 VUs  0m26.2s/4m0s

running (2m28.0s), 113/125 VUs, 182 complete and 0 interrupted iterations
warm_cache       ↓ [ 100% ] 25 VUs   2m0s
tabs_traffic_100   [  11% ] 100 VUs  0m27.2s/4m0s

running (2m29.0s), 113/125 VUs, 187 complete and 0 interrupted iterations
warm_cache       ↓ [ 100% ] 25 VUs   2m0s
tabs_traffic_100   [  12% ] 100 VUs  0m28.2s/4m0s

running (2m30.0s), 113/125 VUs, 188 complete and 0 interrupted iterations
warm_cache       ↓ [ 100% ] 25 VUs   2m0s
tabs_traffic_100   [  12% ] 100 VUs  0m29.2s/4m0s

running (2m31.0s), 100/125 VUs, 194 complete and 12 interrupted iterations
warm_cache       ✓ [ 100% ] 25 VUs   2m0s
tabs_traffic_100   [  13% ] 100 VUs  0m30.2s/4m0s

running (2m32.0s), 100/125 VUs, 196 complete and 12 interrupted iterations
warm_cache       ✓ [ 100% ] 25 VUs   2m0s
tabs_traffic_100   [  13% ] 100 VUs  0m31.2s/4m0s

running (2m33.0s), 100/125 VUs, 198 complete and 12 interrupted iterations
warm_cache       ✓ [ 100% ] 25 VUs   2m0s
tabs_traffic_100   [  13% ] 100 VUs  0m32.2s/4m0s

running (2m34.0s), 100/125 VUs, 203 complete and 12 interrupted iterations
warm_cache       ✓ [ 100% ] 25 VUs   2m0s
tabs_traffic_100   [  14% ] 100 VUs  0m33.2s/4m0s

running (2m35.0s), 100/125 VUs, 208 complete and 12 interrupted iterations
warm_cache       ✓ [ 100% ] 25 VUs   2m0s
tabs_traffic_100   [  14% ] 100 VUs  0m34.2s/4m0s

running (2m36.0s), 100/125 VUs, 212 complete and 12 interrupted iterations
warm_cache       ✓ [ 100% ] 25 VUs   2m0s
tabs_traffic_100   [  15% ] 100 VUs  0m35.2s/4m0s

running (2m37.0s), 100/125 VUs, 214 complete and 12 interrupted iterations
warm_cache       ✓ [ 100% ] 25 VUs   2m0s
tabs_traffic_100   [  15% ] 100 VUs  0m36.2s/4m0s

running (2m38.0s), 100/125 VUs, 218 complete and 12 interrupted iterations
warm_cache       ✓ [ 100% ] 25 VUs   2m0s
tabs_traffic_100   [  15% ] 100 VUs  0m37.2s/4m0s

running (2m39.0s), 100/125 VUs, 219 complete and 12 interrupted iterations
warm_cache       ✓ [ 100% ] 25 VUs   2m0s
tabs_traffic_100   [  16% ] 100 VUs  0m38.2s/4m0s

running (2m40.0s), 100/125 VUs, 220 complete and 12 interrupted iterations
warm_cache       ✓ [ 100% ] 25 VUs   2m0s
tabs_traffic_100   [  16% ] 100 VUs  0m39.2s/4m0s

running (2m41.0s), 100/125 VUs, 227 complete and 12 interrupted iterations
warm_cache       ✓ [ 100% ] 25 VUs   2m0s
tabs_traffic_100   [  17% ] 100 VUs  0m40.2s/4m0s

running (2m42.0s), 100/125 VUs, 229 complete and 12 interrupted iterations
warm_cache       ✓ [ 100% ] 25 VUs   2m0s
tabs_traffic_100   [  17% ] 100 VUs  0m41.2s/4m0s

running (2m43.0s), 100/125 VUs, 232 complete and 12 interrupted iterations
warm_cache       ✓ [ 100% ] 25 VUs   2m0s
tabs_traffic_100   [  18% ] 100 VUs  0m42.2s/4m0s

running (2m44.0s), 100/125 VUs, 236 complete and 12 interrupted iterations
warm_cache       ✓ [ 100% ] 25 VUs   2m0s
tabs_traffic_100   [  18% ] 100 VUs  0m43.2s/4m0s

running (2m45.0s), 100/125 VUs, 242 complete and 12 interrupted iterations
warm_cache       ✓ [ 100% ] 25 VUs   2m0s
tabs_traffic_100   [  18% ] 100 VUs  0m44.2s/4m0s

running (2m46.0s), 100/125 VUs, 246 complete and 12 interrupted iterations
warm_cache       ✓ [ 100% ] 25 VUs   2m0s
tabs_traffic_100   [  19% ] 100 VUs  0m45.2s/4m0s

running (2m47.0s), 100/125 VUs, 247 complete and 12 interrupted iterations
warm_cache       ✓ [ 100% ] 25 VUs   2m0s
tabs_traffic_100   [  19% ] 100 VUs  0m46.2s/4m0s

running (2m48.0s), 100/125 VUs, 250 complete and 12 interrupted iterations
warm_cache       ✓ [ 100% ] 25 VUs   2m0s
tabs_traffic_100   [  20% ] 100 VUs  0m47.2s/4m0s

running (2m49.0s), 100/125 VUs, 254 complete and 12 interrupted iterations
warm_cache       ✓ [ 100% ] 25 VUs   2m0s
tabs_traffic_100   [  20% ] 100 VUs  0m48.2s/4m0s

running (2m50.0s), 100/125 VUs, 256 complete and 12 interrupted iterations
warm_cache       ✓ [ 100% ] 25 VUs   2m0s
tabs_traffic_100   [  20% ] 100 VUs  0m49.2s/4m0s

running (2m51.0s), 100/125 VUs, 262 complete and 12 interrupted iterations
warm_cache       ✓ [ 100% ] 25 VUs   2m0s
tabs_traffic_100   [  21% ] 100 VUs  0m50.2s/4m0s

running (2m52.0s), 100/125 VUs, 265 complete and 12 interrupted iterations
warm_cache       ✓ [ 100% ] 25 VUs   2m0s
tabs_traffic_100   [  21% ] 100 VUs  0m51.2s/4m0s

running (2m53.0s), 100/125 VUs, 271 complete and 12 interrupted iterations
warm_cache       ✓ [ 100% ] 25 VUs   2m0s
tabs_traffic_100   [  22% ] 100 VUs  0m52.2s/4m0s

running (2m54.0s), 100/125 VUs, 278 complete and 12 interrupted iterations
warm_cache       ✓ [ 100% ] 25 VUs   2m0s
tabs_traffic_100   [  22% ] 100 VUs  0m53.2s/4m0s

running (2m55.0s), 100/125 VUs, 281 complete and 12 interrupted iterations
warm_cache       ✓ [ 100% ] 25 VUs   2m0s
tabs_traffic_100   [  23% ] 100 VUs  0m54.2s/4m0s

running (2m56.0s), 100/125 VUs, 288 complete and 12 interrupted iterations
warm_cache       ✓ [ 100% ] 25 VUs   2m0s
tabs_traffic_100   [  23% ] 100 VUs  0m55.2s/4m0s

running (2m57.0s), 100/125 VUs, 288 complete and 12 interrupted iterations
warm_cache       ✓ [ 100% ] 25 VUs   2m0s
tabs_traffic_100   [  23% ] 100 VUs  0m56.2s/4m0s

running (2m58.0s), 100/125 VUs, 292 complete and 12 interrupted iterations
warm_cache       ✓ [ 100% ] 25 VUs   2m0s
tabs_traffic_100   [  24% ] 100 VUs  0m57.2s/4m0s

running (2m59.0s), 100/125 VUs, 295 complete and 12 interrupted iterations
warm_cache       ✓ [ 100% ] 25 VUs   2m0s
tabs_traffic_100   [  24% ] 100 VUs  0m58.2s/4m0s

running (3m00.0s), 100/125 VUs, 300 complete and 12 interrupted iterations
warm_cache       ✓ [ 100% ] 25 VUs   2m0s
tabs_traffic_100   [  25% ] 100 VUs  0m59.2s/4m0s

running (3m01.0s), 100/125 VUs, 301 complete and 12 interrupted iterations
warm_cache       ✓ [ 100% ] 25 VUs   2m0s
tabs_traffic_100   [  25% ] 100 VUs  1m00.2s/4m0s

running (3m02.0s), 100/125 VUs, 307 complete and 12 interrupted iterations
warm_cache       ✓ [ 100% ] 25 VUs   2m0s
tabs_traffic_100   [  25% ] 100 VUs  1m01.2s/4m0s

running (3m03.0s), 100/125 VUs, 309 complete and 12 interrupted iterations
warm_cache       ✓ [ 100% ] 25 VUs   2m0s
tabs_traffic_100   [  26% ] 100 VUs  1m02.2s/4m0s

running (3m04.0s), 100/125 VUs, 311 complete and 12 interrupted iterations
warm_cache       ✓ [ 100% ] 25 VUs   2m0s
tabs_traffic_100   [  26% ] 100 VUs  1m03.2s/4m0s

running (3m05.0s), 100/125 VUs, 320 complete and 12 interrupted iterations
warm_cache       ✓ [ 100% ] 25 VUs   2m0s
tabs_traffic_100   [  27% ] 100 VUs  1m04.2s/4m0s

running (3m06.0s), 100/125 VUs, 323 complete and 12 interrupted iterations
warm_cache       ✓ [ 100% ] 25 VUs   2m0s
tabs_traffic_100   [  27% ] 100 VUs  1m05.2s/4m0s

running (3m07.0s), 100/125 VUs, 328 complete and 12 interrupted iterations
warm_cache       ✓ [ 100% ] 25 VUs   2m0s
tabs_traffic_100   [  28% ] 100 VUs  1m06.2s/4m0s

running (3m08.0s), 100/125 VUs, 333 complete and 12 interrupted iterations
warm_cache       ✓ [ 100% ] 25 VUs   2m0s
tabs_traffic_100   [  28% ] 100 VUs  1m07.2s/4m0s

running (3m09.0s), 100/125 VUs, 334 complete and 12 interrupted iterations
warm_cache       ✓ [ 100% ] 25 VUs   2m0s
tabs_traffic_100   [  28% ] 100 VUs  1m08.2s/4m0s

running (3m10.0s), 100/125 VUs, 337 complete and 12 interrupted iterations
warm_cache       ✓ [ 100% ] 25 VUs   2m0s
tabs_traffic_100   [  29% ] 100 VUs  1m09.2s/4m0s

running (3m11.0s), 100/125 VUs, 338 complete and 12 interrupted iterations
warm_cache       ✓ [ 100% ] 25 VUs   2m0s
tabs_traffic_100   [  29% ] 100 VUs  1m10.2s/4m0s

running (3m12.0s), 100/125 VUs, 343 complete and 12 interrupted iterations
warm_cache       ✓ [ 100% ] 25 VUs   2m0s
tabs_traffic_100   [  30% ] 100 VUs  1m11.2s/4m0s

running (3m13.0s), 100/125 VUs, 349 complete and 12 interrupted iterations
warm_cache       ✓ [ 100% ] 25 VUs   2m0s
tabs_traffic_100   [  30% ] 100 VUs  1m12.2s/4m0s

running (3m14.0s), 100/125 VUs, 353 complete and 12 interrupted iterations
warm_cache       ✓ [ 100% ] 25 VUs   2m0s
tabs_traffic_100   [  30% ] 100 VUs  1m13.2s/4m0s

running (3m15.0s), 100/125 VUs, 356 complete and 12 interrupted iterations
warm_cache       ✓ [ 100% ] 25 VUs   2m0s
tabs_traffic_100   [  31% ] 100 VUs  1m14.2s/4m0s

running (3m16.0s), 100/125 VUs, 360 complete and 12 interrupted iterations
warm_cache       ✓ [ 100% ] 25 VUs   2m0s
tabs_traffic_100   [  31% ] 100 VUs  1m15.2s/4m0s

running (3m17.0s), 100/125 VUs, 363 complete and 12 interrupted iterations
warm_cache       ✓ [ 100% ] 25 VUs   2m0s
tabs_traffic_100   [  32% ] 100 VUs  1m16.2s/4m0s

running (3m18.0s), 100/125 VUs, 369 complete and 12 interrupted iterations
warm_cache       ✓ [ 100% ] 25 VUs   2m0s
tabs_traffic_100   [  32% ] 100 VUs  1m17.2s/4m0s

running (3m19.0s), 100/125 VUs, 374 complete and 12 interrupted iterations
warm_cache       ✓ [ 100% ] 25 VUs   2m0s
tabs_traffic_100   [  33% ] 100 VUs  1m18.2s/4m0s

running (3m20.0s), 100/125 VUs, 379 complete and 12 interrupted iterations
warm_cache       ✓ [ 100% ] 25 VUs   2m0s
tabs_traffic_100   [  33% ] 100 VUs  1m19.2s/4m0s

running (3m21.0s), 100/125 VUs, 386 complete and 12 interrupted iterations
warm_cache       ✓ [ 100% ] 25 VUs   2m0s
tabs_traffic_100   [  33% ] 100 VUs  1m20.2s/4m0s

running (3m22.0s), 100/125 VUs, 387 complete and 12 interrupted iterations
warm_cache       ✓ [ 100% ] 25 VUs   2m0s
tabs_traffic_100   [  34% ] 100 VUs  1m21.2s/4m0s

running (3m23.0s), 100/125 VUs, 393 complete and 12 interrupted iterations
warm_cache       ✓ [ 100% ] 25 VUs   2m0s
tabs_traffic_100   [  34% ] 100 VUs  1m22.2s/4m0s

running (3m24.0s), 100/125 VUs, 396 complete and 12 interrupted iterations
warm_cache       ✓ [ 100% ] 25 VUs   2m0s
tabs_traffic_100   [  35% ] 100 VUs  1m23.2s/4m0s

running (3m25.0s), 100/125 VUs, 400 complete and 12 interrupted iterations
warm_cache       ✓ [ 100% ] 25 VUs   2m0s
tabs_traffic_100   [  35% ] 100 VUs  1m24.2s/4m0s

running (3m26.0s), 100/125 VUs, 404 complete and 12 interrupted iterations
warm_cache       ✓ [ 100% ] 25 VUs   2m0s
tabs_traffic_100   [  35% ] 100 VUs  1m25.2s/4m0s

running (3m27.0s), 100/125 VUs, 404 complete and 12 interrupted iterations
warm_cache       ✓ [ 100% ] 25 VUs   2m0s
tabs_traffic_100   [  36% ] 100 VUs  1m26.2s/4m0s

running (3m28.0s), 100/125 VUs, 409 complete and 12 interrupted iterations
warm_cache       ✓ [ 100% ] 25 VUs   2m0s
tabs_traffic_100   [  36% ] 100 VUs  1m27.2s/4m0s

running (3m29.0s), 100/125 VUs, 417 complete and 12 interrupted iterations
warm_cache       ✓ [ 100% ] 25 VUs   2m0s
tabs_traffic_100   [  37% ] 100 VUs  1m28.2s/4m0s

running (3m30.0s), 100/125 VUs, 419 complete and 12 interrupted iterations
warm_cache       ✓ [ 100% ] 25 VUs   2m0s
tabs_traffic_100   [  37% ] 100 VUs  1m29.2s/4m0s

running (3m31.0s), 100/125 VUs, 423 complete and 12 interrupted iterations
warm_cache       ✓ [ 100% ] 25 VUs   2m0s
tabs_traffic_100   [  38% ] 100 VUs  1m30.2s/4m0s

running (3m32.0s), 100/125 VUs, 426 complete and 12 interrupted iterations
warm_cache       ✓ [ 100% ] 25 VUs   2m0s
tabs_traffic_100   [  38% ] 100 VUs  1m31.2s/4m0s

running (3m33.0s), 100/125 VUs, 430 complete and 12 interrupted iterations
warm_cache       ✓ [ 100% ] 25 VUs   2m0s
tabs_traffic_100   [  38% ] 100 VUs  1m32.2s/4m0s

running (3m34.0s), 100/125 VUs, 430 complete and 12 interrupted iterations
warm_cache       ✓ [ 100% ] 25 VUs   2m0s
tabs_traffic_100   [  39% ] 100 VUs  1m33.2s/4m0s

running (3m35.0s), 100/125 VUs, 433 complete and 12 interrupted iterations
warm_cache       ✓ [ 100% ] 25 VUs   2m0s
tabs_traffic_100   [  39% ] 100 VUs  1m34.2s/4m0s

running (3m36.0s), 100/125 VUs, 436 complete and 12 interrupted iterations
warm_cache       ✓ [ 100% ] 25 VUs   2m0s
tabs_traffic_100   [  40% ] 100 VUs  1m35.2s/4m0s

running (3m37.0s), 100/125 VUs, 441 complete and 12 interrupted iterations
warm_cache       ✓ [ 100% ] 25 VUs   2m0s
tabs_traffic_100   [  40% ] 100 VUs  1m36.2s/4m0s

running (3m38.0s), 100/125 VUs, 445 complete and 12 interrupted iterations
warm_cache       ✓ [ 100% ] 25 VUs   2m0s
tabs_traffic_100   [  40% ] 100 VUs  1m37.2s/4m0s

running (3m39.0s), 100/125 VUs, 449 complete and 12 interrupted iterations
warm_cache       ✓ [ 100% ] 25 VUs   2m0s
tabs_traffic_100   [  41% ] 100 VUs  1m38.2s/4m0s

running (3m40.0s), 100/125 VUs, 451 complete and 12 interrupted iterations
warm_cache       ✓ [ 100% ] 25 VUs   2m0s
tabs_traffic_100   [  41% ] 100 VUs  1m39.2s/4m0s

running (3m41.0s), 100/125 VUs, 454 complete and 12 interrupted iterations
warm_cache       ✓ [ 100% ] 25 VUs   2m0s
tabs_traffic_100   [  42% ] 100 VUs  1m40.2s/4m0s

running (3m42.0s), 100/125 VUs, 462 complete and 12 interrupted iterations
warm_cache       ✓ [ 100% ] 25 VUs   2m0s
tabs_traffic_100   [  42% ] 100 VUs  1m41.2s/4m0s

running (3m43.0s), 100/125 VUs, 469 complete and 12 interrupted iterations
warm_cache       ✓ [ 100% ] 25 VUs   2m0s
tabs_traffic_100   [  43% ] 100 VUs  1m42.2s/4m0s

running (3m44.0s), 100/125 VUs, 473 complete and 12 interrupted iterations
warm_cache       ✓ [ 100% ] 25 VUs   2m0s
tabs_traffic_100   [  43% ] 100 VUs  1m43.2s/4m0s

running (3m45.0s), 100/125 VUs, 476 complete and 12 interrupted iterations
warm_cache       ✓ [ 100% ] 25 VUs   2m0s
tabs_traffic_100   [  43% ] 100 VUs  1m44.2s/4m0s

running (3m46.0s), 100/125 VUs, 479 complete and 12 interrupted iterations
warm_cache       ✓ [ 100% ] 25 VUs   2m0s
tabs_traffic_100   [  44% ] 100 VUs  1m45.2s/4m0s

running (3m47.0s), 100/125 VUs, 483 complete and 12 interrupted iterations
warm_cache       ✓ [ 100% ] 25 VUs   2m0s
tabs_traffic_100   [  44% ] 100 VUs  1m46.2s/4m0s

running (3m48.0s), 100/125 VUs, 483 complete and 12 interrupted iterations
warm_cache       ✓ [ 100% ] 25 VUs   2m0s
tabs_traffic_100   [  45% ] 100 VUs  1m47.2s/4m0s

running (3m49.0s), 100/125 VUs, 488 complete and 12 interrupted iterations
warm_cache       ✓ [ 100% ] 25 VUs   2m0s
tabs_traffic_100   [  45% ] 100 VUs  1m48.2s/4m0s

running (3m50.0s), 100/125 VUs, 496 complete and 12 interrupted iterations
warm_cache       ✓ [ 100% ] 25 VUs   2m0s
tabs_traffic_100   [  45% ] 100 VUs  1m49.2s/4m0s

running (3m51.0s), 100/125 VUs, 502 complete and 12 interrupted iterations
warm_cache       ✓ [ 100% ] 25 VUs   2m0s
tabs_traffic_100   [  46% ] 100 VUs  1m50.2s/4m0s

running (3m52.0s), 100/125 VUs, 507 complete and 12 interrupted iterations
warm_cache       ✓ [ 100% ] 25 VUs   2m0s
tabs_traffic_100   [  46% ] 100 VUs  1m51.2s/4m0s

running (3m53.0s), 100/125 VUs, 513 complete and 12 interrupted iterations
warm_cache       ✓ [ 100% ] 25 VUs   2m0s
tabs_traffic_100   [  47% ] 100 VUs  1m52.2s/4m0s

running (3m54.0s), 100/125 VUs, 518 complete and 12 interrupted iterations
warm_cache       ✓ [ 100% ] 25 VUs   2m0s
tabs_traffic_100   [  47% ] 100 VUs  1m53.2s/4m0s

running (3m55.0s), 100/125 VUs, 521 complete and 12 interrupted iterations
warm_cache       ✓ [ 100% ] 25 VUs   2m0s
tabs_traffic_100   [  48% ] 100 VUs  1m54.2s/4m0s

running (3m56.0s), 100/125 VUs, 528 complete and 12 interrupted iterations
warm_cache       ✓ [ 100% ] 25 VUs   2m0s
tabs_traffic_100   [  48% ] 100 VUs  1m55.2s/4m0s

running (3m57.0s), 100/125 VUs, 530 complete and 12 interrupted iterations
warm_cache       ✓ [ 100% ] 25 VUs   2m0s
tabs_traffic_100   [  48% ] 100 VUs  1m56.2s/4m0s

running (3m58.0s), 100/125 VUs, 536 complete and 12 interrupted iterations
warm_cache       ✓ [ 100% ] 25 VUs   2m0s
tabs_traffic_100   [  49% ] 100 VUs  1m57.2s/4m0s

running (3m59.0s), 100/125 VUs, 540 complete and 12 interrupted iterations
warm_cache       ✓ [ 100% ] 25 VUs   2m0s
tabs_traffic_100   [  49% ] 100 VUs  1m58.2s/4m0s

running (4m00.0s), 100/125 VUs, 545 complete and 12 interrupted iterations
warm_cache       ✓ [ 100% ] 25 VUs   2m0s
tabs_traffic_100   [  50% ] 100 VUs  1m59.2s/4m0s

running (4m01.0s), 100/125 VUs, 546 complete and 12 interrupted iterations
warm_cache       ✓ [ 100% ] 25 VUs   2m0s
tabs_traffic_100   [  50% ] 100 VUs  2m00.2s/4m0s

running (4m02.0s), 100/125 VUs, 550 complete and 12 interrupted iterations
warm_cache       ✓ [ 100% ] 25 VUs   2m0s
tabs_traffic_100   [  50% ] 100 VUs  2m01.2s/4m0s

running (4m03.0s), 100/125 VUs, 551 complete and 12 interrupted iterations
warm_cache       ✓ [ 100% ] 25 VUs   2m0s
tabs_traffic_100   [  51% ] 100 VUs  2m02.2s/4m0s

running (4m04.0s), 100/125 VUs, 556 complete and 12 interrupted iterations
warm_cache       ✓ [ 100% ] 25 VUs   2m0s
tabs_traffic_100   [  51% ] 100 VUs  2m03.2s/4m0s

running (4m05.0s), 100/125 VUs, 557 complete and 12 interrupted iterations
warm_cache       ✓ [ 100% ] 25 VUs   2m0s
tabs_traffic_100   [  52% ] 100 VUs  2m04.2s/4m0s

running (4m06.0s), 100/125 VUs, 567 complete and 12 interrupted iterations
warm_cache       ✓ [ 100% ] 25 VUs   2m0s
tabs_traffic_100   [  52% ] 100 VUs  2m05.2s/4m0s

running (4m07.0s), 100/125 VUs, 568 complete and 12 interrupted iterations
warm_cache       ✓ [ 100% ] 25 VUs   2m0s
tabs_traffic_100   [  53% ] 100 VUs  2m06.2s/4m0s

running (4m08.0s), 100/125 VUs, 575 complete and 12 interrupted iterations
warm_cache       ✓ [ 100% ] 25 VUs   2m0s
tabs_traffic_100   [  53% ] 100 VUs  2m07.2s/4m0s

running (4m09.0s), 100/125 VUs, 579 complete and 12 interrupted iterations
warm_cache       ✓ [ 100% ] 25 VUs   2m0s
tabs_traffic_100   [  53% ] 100 VUs  2m08.2s/4m0s

running (4m10.0s), 100/125 VUs, 582 complete and 12 interrupted iterations
warm_cache       ✓ [ 100% ] 25 VUs   2m0s
tabs_traffic_100   [  54% ] 100 VUs  2m09.2s/4m0s

running (4m11.0s), 100/125 VUs, 584 complete and 12 interrupted iterations
warm_cache       ✓ [ 100% ] 25 VUs   2m0s
tabs_traffic_100   [  54% ] 100 VUs  2m10.2s/4m0s

running (4m12.0s), 100/125 VUs, 588 complete and 12 interrupted iterations
warm_cache       ✓ [ 100% ] 25 VUs   2m0s
tabs_traffic_100   [  55% ] 100 VUs  2m11.2s/4m0s

running (4m13.0s), 100/125 VUs, 592 complete and 12 interrupted iterations
warm_cache       ✓ [ 100% ] 25 VUs   2m0s
tabs_traffic_100   [  55% ] 100 VUs  2m12.2s/4m0s

running (4m14.0s), 100/125 VUs, 597 complete and 12 interrupted iterations
warm_cache       ✓ [ 100% ] 25 VUs   2m0s
tabs_traffic_100   [  55% ] 100 VUs  2m13.2s/4m0s

running (4m15.0s), 100/125 VUs, 605 complete and 12 interrupted iterations
warm_cache       ✓ [ 100% ] 25 VUs   2m0s
tabs_traffic_100   [  56% ] 100 VUs  2m14.2s/4m0s

running (4m16.0s), 100/125 VUs, 607 complete and 12 interrupted iterations
warm_cache       ✓ [ 100% ] 25 VUs   2m0s
tabs_traffic_100   [  56% ] 100 VUs  2m15.2s/4m0s

running (4m17.0s), 100/125 VUs, 612 complete and 12 interrupted iterations
warm_cache       ✓ [ 100% ] 25 VUs   2m0s
tabs_traffic_100   [  57% ] 100 VUs  2m16.2s/4m0s

running (4m18.0s), 100/125 VUs, 616 complete and 12 interrupted iterations
warm_cache       ✓ [ 100% ] 25 VUs   2m0s
tabs_traffic_100   [  57% ] 100 VUs  2m17.2s/4m0s

running (4m19.0s), 100/125 VUs, 619 complete and 12 interrupted iterations
warm_cache       ✓ [ 100% ] 25 VUs   2m0s
tabs_traffic_100   [  58% ] 100 VUs  2m18.2s/4m0s

running (4m20.0s), 100/125 VUs, 624 complete and 12 interrupted iterations
warm_cache       ✓ [ 100% ] 25 VUs   2m0s
tabs_traffic_100   [  58% ] 100 VUs  2m19.2s/4m0s

running (4m21.0s), 100/125 VUs, 628 complete and 12 interrupted iterations
warm_cache       ✓ [ 100% ] 25 VUs   2m0s
tabs_traffic_100   [  58% ] 100 VUs  2m20.2s/4m0s

running (4m22.0s), 100/125 VUs, 635 complete and 12 interrupted iterations
warm_cache       ✓ [ 100% ] 25 VUs   2m0s
tabs_traffic_100   [  59% ] 100 VUs  2m21.2s/4m0s

running (4m23.0s), 100/125 VUs, 636 complete and 12 interrupted iterations
warm_cache       ✓ [ 100% ] 25 VUs   2m0s
tabs_traffic_100   [  59% ] 100 VUs  2m22.2s/4m0s

running (4m24.0s), 100/125 VUs, 638 complete and 12 interrupted iterations
warm_cache       ✓ [ 100% ] 25 VUs   2m0s
tabs_traffic_100   [  60% ] 100 VUs  2m23.2s/4m0s

running (4m25.0s), 100/125 VUs, 641 complete and 12 interrupted iterations
warm_cache       ✓ [ 100% ] 25 VUs   2m0s
tabs_traffic_100   [  60% ] 100 VUs  2m24.2s/4m0s

running (4m26.0s), 100/125 VUs, 644 complete and 12 interrupted iterations
warm_cache       ✓ [ 100% ] 25 VUs   2m0s
tabs_traffic_100   [  60% ] 100 VUs  2m25.2s/4m0s

running (4m27.0s), 100/125 VUs, 648 complete and 12 interrupted iterations
warm_cache       ✓ [ 100% ] 25 VUs   2m0s
tabs_traffic_100   [  61% ] 100 VUs  2m26.2s/4m0s

running (4m28.0s), 100/125 VUs, 652 complete and 12 interrupted iterations
warm_cache       ✓ [ 100% ] 25 VUs   2m0s
tabs_traffic_100   [  61% ] 100 VUs  2m27.2s/4m0s

running (4m29.0s), 100/125 VUs, 659 complete and 12 interrupted iterations
warm_cache       ✓ [ 100% ] 25 VUs   2m0s
tabs_traffic_100   [  62% ] 100 VUs  2m28.2s/4m0s

running (4m30.0s), 100/125 VUs, 664 complete and 12 interrupted iterations
warm_cache       ✓ [ 100% ] 25 VUs   2m0s
tabs_traffic_100   [  62% ] 100 VUs  2m29.2s/4m0s

running (4m31.0s), 100/125 VUs, 667 complete and 12 interrupted iterations
warm_cache       ✓ [ 100% ] 25 VUs   2m0s
tabs_traffic_100   [  63% ] 100 VUs  2m30.2s/4m0s

running (4m32.0s), 100/125 VUs, 673 complete and 12 interrupted iterations
warm_cache       ✓ [ 100% ] 25 VUs   2m0s
tabs_traffic_100   [  63% ] 100 VUs  2m31.2s/4m0s

running (4m33.0s), 100/125 VUs, 677 complete and 12 interrupted iterations
warm_cache       ✓ [ 100% ] 25 VUs   2m0s
tabs_traffic_100   [  63% ] 100 VUs  2m32.2s/4m0s

running (4m34.0s), 100/125 VUs, 679 complete and 12 interrupted iterations
warm_cache       ✓ [ 100% ] 25 VUs   2m0s
tabs_traffic_100   [  64% ] 100 VUs  2m33.2s/4m0s

running (4m35.0s), 100/125 VUs, 682 complete and 12 interrupted iterations
warm_cache       ✓ [ 100% ] 25 VUs   2m0s
tabs_traffic_100   [  64% ] 100 VUs  2m34.2s/4m0s

running (4m36.0s), 100/125 VUs, 691 complete and 12 interrupted iterations
warm_cache       ✓ [ 100% ] 25 VUs   2m0s
tabs_traffic_100   [  65% ] 100 VUs  2m35.2s/4m0s

running (4m37.0s), 100/125 VUs, 695 complete and 12 interrupted iterations
warm_cache       ✓ [ 100% ] 25 VUs   2m0s
tabs_traffic_100   [  65% ] 100 VUs  2m36.2s/4m0s

running (4m38.0s), 100/125 VUs, 697 complete and 12 interrupted iterations
warm_cache       ✓ [ 100% ] 25 VUs   2m0s
tabs_traffic_100   [  65% ] 100 VUs  2m37.2s/4m0s

running (4m39.0s), 100/125 VUs, 700 complete and 12 interrupted iterations
warm_cache       ✓ [ 100% ] 25 VUs   2m0s
tabs_traffic_100   [  66% ] 100 VUs  2m38.2s/4m0s

running (4m40.0s), 100/125 VUs, 701 complete and 12 interrupted iterations
warm_cache       ✓ [ 100% ] 25 VUs   2m0s
tabs_traffic_100   [  66% ] 100 VUs  2m39.2s/4m0s

running (4m41.0s), 100/125 VUs, 709 complete and 12 interrupted iterations
warm_cache       ✓ [ 100% ] 25 VUs   2m0s
tabs_traffic_100   [  67% ] 100 VUs  2m40.2s/4m0s

running (4m42.0s), 100/125 VUs, 713 complete and 12 interrupted iterations
warm_cache       ✓ [ 100% ] 25 VUs   2m0s
tabs_traffic_100   [  67% ] 100 VUs  2m41.2s/4m0s

running (4m43.0s), 100/125 VUs, 718 complete and 12 interrupted iterations
warm_cache       ✓ [ 100% ] 25 VUs   2m0s
tabs_traffic_100   [  68% ] 100 VUs  2m42.2s/4m0s

running (4m44.0s), 100/125 VUs, 720 complete and 12 interrupted iterations
warm_cache       ✓ [ 100% ] 25 VUs   2m0s
tabs_traffic_100   [  68% ] 100 VUs  2m43.2s/4m0s

running (4m45.0s), 100/125 VUs, 723 complete and 12 interrupted iterations
warm_cache       ✓ [ 100% ] 25 VUs   2m0s
tabs_traffic_100   [  68% ] 100 VUs  2m44.2s/4m0s

running (4m46.0s), 100/125 VUs, 726 complete and 12 interrupted iterations
warm_cache       ✓ [ 100% ] 25 VUs   2m0s
tabs_traffic_100   [  69% ] 100 VUs  2m45.2s/4m0s

running (4m47.0s), 100/125 VUs, 728 complete and 12 interrupted iterations
warm_cache       ✓ [ 100% ] 25 VUs   2m0s
tabs_traffic_100   [  69% ] 100 VUs  2m46.2s/4m0s

running (4m48.0s), 100/125 VUs, 732 complete and 12 interrupted iterations
warm_cache       ✓ [ 100% ] 25 VUs   2m0s
tabs_traffic_100   [  70% ] 100 VUs  2m47.2s/4m0s

running (4m49.0s), 100/125 VUs, 740 complete and 12 interrupted iterations
warm_cache       ✓ [ 100% ] 25 VUs   2m0s
tabs_traffic_100   [  70% ] 100 VUs  2m48.2s/4m0s

running (4m50.0s), 100/125 VUs, 745 complete and 12 interrupted iterations
warm_cache       ✓ [ 100% ] 25 VUs   2m0s
tabs_traffic_100   [  70% ] 100 VUs  2m49.2s/4m0s

running (4m51.0s), 100/125 VUs, 748 complete and 12 interrupted iterations
warm_cache       ✓ [ 100% ] 25 VUs   2m0s
tabs_traffic_100   [  71% ] 100 VUs  2m50.2s/4m0s

running (4m52.0s), 100/125 VUs, 752 complete and 12 interrupted iterations
warm_cache       ✓ [ 100% ] 25 VUs   2m0s
tabs_traffic_100   [  71% ] 100 VUs  2m51.2s/4m0s

running (4m53.0s), 100/125 VUs, 758 complete and 12 interrupted iterations
warm_cache       ✓ [ 100% ] 25 VUs   2m0s
tabs_traffic_100   [  72% ] 100 VUs  2m52.2s/4m0s

running (4m54.0s), 100/125 VUs, 761 complete and 12 interrupted iterations
warm_cache       ✓ [ 100% ] 25 VUs   2m0s
tabs_traffic_100   [  72% ] 100 VUs  2m53.2s/4m0s

running (4m55.0s), 100/125 VUs, 764 complete and 12 interrupted iterations
warm_cache       ✓ [ 100% ] 25 VUs   2m0s
tabs_traffic_100   [  73% ] 100 VUs  2m54.2s/4m0s

running (4m56.0s), 100/125 VUs, 765 complete and 12 interrupted iterations
warm_cache       ✓ [ 100% ] 25 VUs   2m0s
tabs_traffic_100   [  73% ] 100 VUs  2m55.2s/4m0s

running (4m57.0s), 100/125 VUs, 768 complete and 12 interrupted iterations
warm_cache       ✓ [ 100% ] 25 VUs   2m0s
tabs_traffic_100   [  73% ] 100 VUs  2m56.2s/4m0s

running (4m58.0s), 100/125 VUs, 772 complete and 12 interrupted iterations
warm_cache       ✓ [ 100% ] 25 VUs   2m0s
tabs_traffic_100   [  74% ] 100 VUs  2m57.2s/4m0s

running (4m59.0s), 100/125 VUs, 779 complete and 12 interrupted iterations
warm_cache       ✓ [ 100% ] 25 VUs   2m0s
tabs_traffic_100   [  74% ] 100 VUs  2m58.2s/4m0s

running (5m00.0s), 100/125 VUs, 779 complete and 12 interrupted iterations
warm_cache       ✓ [ 100% ] 25 VUs   2m0s
tabs_traffic_100   [  75% ] 100 VUs  2m59.2s/4m0s

running (5m01.0s), 100/125 VUs, 787 complete and 12 interrupted iterations
warm_cache       ✓ [ 100% ] 25 VUs   2m0s
tabs_traffic_100   [  75% ] 100 VUs  3m00.2s/4m0s

running (5m02.0s), 100/125 VUs, 790 complete and 12 interrupted iterations
warm_cache       ✓ [ 100% ] 25 VUs   2m0s
tabs_traffic_100   [  75% ] 100 VUs  3m01.2s/4m0s

running (5m03.0s), 100/125 VUs, 791 complete and 12 interrupted iterations
warm_cache       ✓ [ 100% ] 25 VUs   2m0s
tabs_traffic_100   [  76% ] 100 VUs  3m02.2s/4m0s

running (5m04.0s), 100/125 VUs, 794 complete and 12 interrupted iterations
warm_cache       ✓ [ 100% ] 25 VUs   2m0s
tabs_traffic_100   [  76% ] 100 VUs  3m03.2s/4m0s

running (5m05.0s), 100/125 VUs, 800 complete and 12 interrupted iterations
warm_cache       ✓ [ 100% ] 25 VUs   2m0s
tabs_traffic_100   [  77% ] 100 VUs  3m04.2s/4m0s

running (5m06.0s), 100/125 VUs, 802 complete and 12 interrupted iterations
warm_cache       ✓ [ 100% ] 25 VUs   2m0s
tabs_traffic_100   [  77% ] 100 VUs  3m05.2s/4m0s

running (5m07.0s), 100/125 VUs, 806 complete and 12 interrupted iterations
warm_cache       ✓ [ 100% ] 25 VUs   2m0s
tabs_traffic_100   [  78% ] 100 VUs  3m06.2s/4m0s

running (5m08.0s), 100/125 VUs, 815 complete and 12 interrupted iterations
warm_cache       ✓ [ 100% ] 25 VUs   2m0s
tabs_traffic_100   [  78% ] 100 VUs  3m07.2s/4m0s

running (5m09.0s), 100/125 VUs, 821 complete and 12 interrupted iterations
warm_cache       ✓ [ 100% ] 25 VUs   2m0s
tabs_traffic_100   [  78% ] 100 VUs  3m08.2s/4m0s

running (5m10.0s), 100/125 VUs, 826 complete and 12 interrupted iterations
warm_cache       ✓ [ 100% ] 25 VUs   2m0s
tabs_traffic_100   [  79% ] 100 VUs  3m09.2s/4m0s

running (5m11.0s), 100/125 VUs, 832 complete and 12 interrupted iterations
warm_cache       ✓ [ 100% ] 25 VUs   2m0s
tabs_traffic_100   [  79% ] 100 VUs  3m10.2s/4m0s

running (5m12.0s), 100/125 VUs, 839 complete and 12 interrupted iterations
warm_cache       ✓ [ 100% ] 25 VUs   2m0s
tabs_traffic_100   [  80% ] 100 VUs  3m11.2s/4m0s

running (5m13.0s), 100/125 VUs, 842 complete and 12 interrupted iterations
warm_cache       ✓ [ 100% ] 25 VUs   2m0s
tabs_traffic_100   [  80% ] 100 VUs  3m12.2s/4m0s

running (5m14.0s), 100/125 VUs, 845 complete and 12 interrupted iterations
warm_cache       ✓ [ 100% ] 25 VUs   2m0s
tabs_traffic_100   [  80% ] 100 VUs  3m13.2s/4m0s

running (5m15.0s), 100/125 VUs, 847 complete and 12 interrupted iterations
warm_cache       ✓ [ 100% ] 25 VUs   2m0s
tabs_traffic_100   [  81% ] 100 VUs  3m14.2s/4m0s

running (5m16.0s), 100/125 VUs, 855 complete and 12 interrupted iterations
warm_cache       ✓ [ 100% ] 25 VUs   2m0s
tabs_traffic_100   [  81% ] 100 VUs  3m15.2s/4m0s

running (5m17.0s), 100/125 VUs, 856 complete and 12 interrupted iterations
warm_cache       ✓ [ 100% ] 25 VUs   2m0s
tabs_traffic_100   [  82% ] 100 VUs  3m16.2s/4m0s

running (5m18.0s), 100/125 VUs, 860 complete and 12 interrupted iterations
warm_cache       ✓ [ 100% ] 25 VUs   2m0s
tabs_traffic_100   [  82% ] 100 VUs  3m17.2s/4m0s

running (5m19.0s), 100/125 VUs, 867 complete and 12 interrupted iterations
warm_cache       ✓ [ 100% ] 25 VUs   2m0s
tabs_traffic_100   [  83% ] 100 VUs  3m18.2s/4m0s

running (5m20.0s), 100/125 VUs, 868 complete and 12 interrupted iterations
warm_cache       ✓ [ 100% ] 25 VUs   2m0s
tabs_traffic_100   [  83% ] 100 VUs  3m19.2s/4m0s

running (5m21.0s), 100/125 VUs, 870 complete and 12 interrupted iterations
warm_cache       ✓ [ 100% ] 25 VUs   2m0s
tabs_traffic_100   [  83% ] 100 VUs  3m20.2s/4m0s

running (5m22.0s), 100/125 VUs, 874 complete and 12 interrupted iterations
warm_cache       ✓ [ 100% ] 25 VUs   2m0s
tabs_traffic_100   [  84% ] 100 VUs  3m21.2s/4m0s

running (5m23.0s), 100/125 VUs, 875 complete and 12 interrupted iterations
warm_cache       ✓ [ 100% ] 25 VUs   2m0s
tabs_traffic_100   [  84% ] 100 VUs  3m22.2s/4m0s

running (5m24.0s), 100/125 VUs, 875 complete and 12 interrupted iterations
warm_cache       ✓ [ 100% ] 25 VUs   2m0s
tabs_traffic_100   [  85% ] 100 VUs  3m23.2s/4m0s

running (5m25.0s), 100/125 VUs, 884 complete and 12 interrupted iterations
warm_cache       ✓ [ 100% ] 25 VUs   2m0s
tabs_traffic_100   [  85% ] 100 VUs  3m24.2s/4m0s

running (5m26.0s), 100/125 VUs, 888 complete and 12 interrupted iterations
warm_cache       ✓ [ 100% ] 25 VUs   2m0s
tabs_traffic_100   [  85% ] 100 VUs  3m25.2s/4m0s

running (5m27.0s), 100/125 VUs, 892 complete and 12 interrupted iterations
warm_cache       ✓ [ 100% ] 25 VUs   2m0s
tabs_traffic_100   [  86% ] 100 VUs  3m26.2s/4m0s

running (5m28.0s), 100/125 VUs, 894 complete and 12 interrupted iterations
warm_cache       ✓ [ 100% ] 25 VUs   2m0s
tabs_traffic_100   [  86% ] 100 VUs  3m27.2s/4m0s

running (5m29.0s), 100/125 VUs, 897 complete and 12 interrupted iterations
warm_cache       ✓ [ 100% ] 25 VUs   2m0s
tabs_traffic_100   [  87% ] 100 VUs  3m28.2s/4m0s

running (5m30.0s), 100/125 VUs, 904 complete and 12 interrupted iterations
warm_cache       ✓ [ 100% ] 25 VUs   2m0s
tabs_traffic_100   [  87% ] 100 VUs  3m29.2s/4m0s

running (5m31.0s), 100/125 VUs, 906 complete and 12 interrupted iterations
warm_cache       ✓ [ 100% ] 25 VUs   2m0s
tabs_traffic_100   [  88% ] 100 VUs  3m30.2s/4m0s

running (5m32.0s), 100/125 VUs, 910 complete and 12 interrupted iterations
warm_cache       ✓ [ 100% ] 25 VUs   2m0s
tabs_traffic_100   [  88% ] 100 VUs  3m31.2s/4m0s

running (5m33.0s), 100/125 VUs, 916 complete and 12 interrupted iterations
warm_cache       ✓ [ 100% ] 25 VUs   2m0s
tabs_traffic_100   [  88% ] 100 VUs  3m32.2s/4m0s

running (5m34.0s), 100/125 VUs, 920 complete and 12 interrupted iterations
warm_cache       ✓ [ 100% ] 25 VUs   2m0s
tabs_traffic_100   [  89% ] 100 VUs  3m33.2s/4m0s

running (5m35.0s), 100/125 VUs, 926 complete and 12 interrupted iterations
warm_cache       ✓ [ 100% ] 25 VUs   2m0s
tabs_traffic_100   [  89% ] 100 VUs  3m34.2s/4m0s

running (5m36.0s), 100/125 VUs, 926 complete and 12 interrupted iterations
warm_cache       ✓ [ 100% ] 25 VUs   2m0s
tabs_traffic_100   [  90% ] 100 VUs  3m35.2s/4m0s

running (5m37.0s), 100/125 VUs, 929 complete and 12 interrupted iterations
warm_cache       ✓ [ 100% ] 25 VUs   2m0s
tabs_traffic_100   [  90% ] 100 VUs  3m36.2s/4m0s

running (5m38.0s), 100/125 VUs, 935 complete and 12 interrupted iterations
warm_cache       ✓ [ 100% ] 25 VUs   2m0s
tabs_traffic_100   [  90% ] 100 VUs  3m37.2s/4m0s

running (5m39.0s), 100/125 VUs, 940 complete and 12 interrupted iterations
warm_cache       ✓ [ 100% ] 25 VUs   2m0s
tabs_traffic_100   [  91% ] 100 VUs  3m38.2s/4m0s

running (5m40.0s), 100/125 VUs, 942 complete and 12 interrupted iterations
warm_cache       ✓ [ 100% ] 25 VUs   2m0s
tabs_traffic_100   [  91% ] 100 VUs  3m39.2s/4m0s

running (5m41.0s), 100/125 VUs, 947 complete and 12 interrupted iterations
warm_cache       ✓ [ 100% ] 25 VUs   2m0s
tabs_traffic_100   [  92% ] 100 VUs  3m40.2s/4m0s

running (5m42.0s), 100/125 VUs, 950 complete and 12 interrupted iterations
warm_cache       ✓ [ 100% ] 25 VUs   2m0s
tabs_traffic_100   [  92% ] 100 VUs  3m41.2s/4m0s

running (5m43.0s), 100/125 VUs, 956 complete and 12 interrupted iterations
warm_cache       ✓ [ 100% ] 25 VUs   2m0s
tabs_traffic_100   [  93% ] 100 VUs  3m42.2s/4m0s

running (5m44.0s), 100/125 VUs, 956 complete and 12 interrupted iterations
warm_cache       ✓ [ 100% ] 25 VUs   2m0s
tabs_traffic_100   [  93% ] 100 VUs  3m43.2s/4m0s

running (5m45.0s), 100/125 VUs, 961 complete and 12 interrupted iterations
warm_cache       ✓ [ 100% ] 25 VUs   2m0s
tabs_traffic_100   [  93% ] 100 VUs  3m44.2s/4m0s

running (5m46.0s), 100/125 VUs, 963 complete and 12 interrupted iterations
warm_cache       ✓ [ 100% ] 25 VUs   2m0s
tabs_traffic_100   [  94% ] 100 VUs  3m45.2s/4m0s

running (5m47.0s), 100/125 VUs, 965 complete and 12 interrupted iterations
warm_cache       ✓ [ 100% ] 25 VUs   2m0s
tabs_traffic_100   [  94% ] 100 VUs  3m46.2s/4m0s

running (5m48.0s), 100/125 VUs, 967 complete and 12 interrupted iterations
warm_cache       ✓ [ 100% ] 25 VUs   2m0s
tabs_traffic_100   [  95% ] 100 VUs  3m47.2s/4m0s

running (5m49.0s), 100/125 VUs, 970 complete and 12 interrupted iterations
warm_cache       ✓ [ 100% ] 25 VUs   2m0s
tabs_traffic_100   [  95% ] 100 VUs  3m48.2s/4m0s

running (5m50.0s), 100/125 VUs, 974 complete and 12 interrupted iterations
warm_cache       ✓ [ 100% ] 25 VUs   2m0s
tabs_traffic_100   [  95% ] 100 VUs  3m49.2s/4m0s

running (5m51.0s), 100/125 VUs, 975 complete and 12 interrupted iterations
warm_cache       ✓ [ 100% ] 25 VUs   2m0s
tabs_traffic_100   [  96% ] 100 VUs  3m50.2s/4m0s

running (5m52.0s), 100/125 VUs, 977 complete and 12 interrupted iterations
warm_cache       ✓ [ 100% ] 25 VUs   2m0s
tabs_traffic_100   [  96% ] 100 VUs  3m51.2s/4m0s

running (5m53.0s), 100/125 VUs, 982 complete and 12 interrupted iterations
warm_cache       ✓ [ 100% ] 25 VUs   2m0s
tabs_traffic_100   [  97% ] 100 VUs  3m52.2s/4m0s

running (5m54.0s), 100/125 VUs, 989 complete and 12 interrupted iterations
warm_cache       ✓ [ 100% ] 25 VUs   2m0s
tabs_traffic_100   [  97% ] 100 VUs  3m53.2s/4m0s

running (5m55.0s), 100/125 VUs, 991 complete and 12 interrupted iterations
warm_cache       ✓ [ 100% ] 25 VUs   2m0s
tabs_traffic_100   [  98% ] 100 VUs  3m54.2s/4m0s

running (5m56.0s), 100/125 VUs, 994 complete and 12 interrupted iterations
warm_cache       ✓ [ 100% ] 25 VUs   2m0s
tabs_traffic_100   [  98% ] 100 VUs  3m55.2s/4m0s

running (5m57.0s), 100/125 VUs, 997 complete and 12 interrupted iterations
warm_cache       ✓ [ 100% ] 25 VUs   2m0s
tabs_traffic_100   [  98% ] 100 VUs  3m56.2s/4m0s

running (5m58.0s), 100/125 VUs, 1002 complete and 12 interrupted iterations
warm_cache       ✓ [ 100% ] 25 VUs   2m0s
tabs_traffic_100   [  99% ] 100 VUs  3m57.2s/4m0s

running (5m59.0s), 100/125 VUs, 1005 complete and 12 interrupted iterations
warm_cache       ✓ [ 100% ] 25 VUs   2m0s
tabs_traffic_100   [  99% ] 100 VUs  3m58.2s/4m0s

running (6m00.0s), 100/125 VUs, 1011 complete and 12 interrupted iterations
warm_cache       ✓ [ 100% ] 25 VUs   2m0s
tabs_traffic_100   [ 100% ] 100 VUs  3m59.2s/4m0s

running (6m01.0s), 100/125 VUs, 1014 complete and 12 interrupted iterations
warm_cache       ✓ [ 100% ] 25 VUs   2m0s
tabs_traffic_100 ↓ [ 100% ] 100 VUs  4m0s

running (6m02.0s), 097/125 VUs, 1017 complete and 12 interrupted iterations
warm_cache       ✓ [ 100% ] 25 VUs   2m0s
tabs_traffic_100 ↓ [ 100% ] 100 VUs  4m0s

running (6m03.0s), 091/125 VUs, 1023 complete and 12 interrupted iterations
warm_cache       ✓ [ 100% ] 25 VUs   2m0s
tabs_traffic_100 ↓ [ 100% ] 100 VUs  4m0s

running (6m04.0s), 089/125 VUs, 1025 complete and 12 interrupted iterations
warm_cache       ✓ [ 100% ] 25 VUs   2m0s
tabs_traffic_100 ↓ [ 100% ] 100 VUs  4m0s

running (6m05.0s), 084/125 VUs, 1030 complete and 12 interrupted iterations
warm_cache       ✓ [ 100% ] 25 VUs   2m0s
tabs_traffic_100 ↓ [ 100% ] 100 VUs  4m0s

running (6m06.0s), 076/125 VUs, 1038 complete and 12 interrupted iterations
warm_cache       ✓ [ 100% ] 25 VUs   2m0s
tabs_traffic_100 ↓ [ 100% ] 100 VUs  4m0s

running (6m07.0s), 073/125 VUs, 1041 complete and 12 interrupted iterations
warm_cache       ✓ [ 100% ] 25 VUs   2m0s
tabs_traffic_100 ↓ [ 100% ] 100 VUs  4m0s

running (6m08.0s), 071/125 VUs, 1043 complete and 12 interrupted iterations
warm_cache       ✓ [ 100% ] 25 VUs   2m0s
tabs_traffic_100 ↓ [ 100% ] 100 VUs  4m0s

running (6m09.0s), 065/125 VUs, 1049 complete and 12 interrupted iterations
warm_cache       ✓ [ 100% ] 25 VUs   2m0s
tabs_traffic_100 ↓ [ 100% ] 100 VUs  4m0s

running (6m10.0s), 058/125 VUs, 1056 complete and 12 interrupted iterations
warm_cache       ✓ [ 100% ] 25 VUs   2m0s
tabs_traffic_100 ↓ [ 100% ] 100 VUs  4m0s

running (6m11.0s), 053/125 VUs, 1061 complete and 12 interrupted iterations
warm_cache       ✓ [ 100% ] 25 VUs   2m0s
tabs_traffic_100 ↓ [ 100% ] 100 VUs  4m0s

running (6m12.0s), 049/125 VUs, 1065 complete and 12 interrupted iterations
warm_cache       ✓ [ 100% ] 25 VUs   2m0s
tabs_traffic_100 ↓ [ 100% ] 100 VUs  4m0s

running (6m13.0s), 045/125 VUs, 1069 complete and 12 interrupted iterations
warm_cache       ✓ [ 100% ] 25 VUs   2m0s
tabs_traffic_100 ↓ [ 100% ] 100 VUs  4m0s

running (6m14.0s), 038/125 VUs, 1076 complete and 12 interrupted iterations
warm_cache       ✓ [ 100% ] 25 VUs   2m0s
tabs_traffic_100 ↓ [ 100% ] 100 VUs  4m0s

running (6m15.0s), 034/125 VUs, 1080 complete and 12 interrupted iterations
warm_cache       ✓ [ 100% ] 25 VUs   2m0s
tabs_traffic_100 ↓ [ 100% ] 100 VUs  4m0s

running (6m16.0s), 028/125 VUs, 1086 complete and 12 interrupted iterations
warm_cache       ✓ [ 100% ] 25 VUs   2m0s
tabs_traffic_100 ↓ [ 100% ] 100 VUs  4m0s

running (6m17.0s), 020/125 VUs, 1094 complete and 12 interrupted iterations
warm_cache       ✓ [ 100% ] 25 VUs   2m0s
tabs_traffic_100 ↓ [ 100% ] 100 VUs  4m0s

running (6m18.0s), 016/125 VUs, 1098 complete and 12 interrupted iterations
warm_cache       ✓ [ 100% ] 25 VUs   2m0s
tabs_traffic_100 ↓ [ 100% ] 100 VUs  4m0s

running (6m19.0s), 013/125 VUs, 1101 complete and 12 interrupted iterations
warm_cache       ✓ [ 100% ] 25 VUs   2m0s
tabs_traffic_100 ↓ [ 100% ] 100 VUs  4m0s

running (6m20.0s), 008/125 VUs, 1106 complete and 12 interrupted iterations
warm_cache       ✓ [ 100% ] 25 VUs   2m0s
tabs_traffic_100 ↓ [ 100% ] 100 VUs  4m0s

running (6m21.0s), 005/125 VUs, 1109 complete and 12 interrupted iterations
warm_cache       ✓ [ 100% ] 25 VUs   2m0s
tabs_traffic_100 ↓ [ 100% ] 100 VUs  4m0s

running (6m22.0s), 004/125 VUs, 1110 complete and 12 interrupted iterations
warm_cache       ✓ [ 100% ] 25 VUs   2m0s
tabs_traffic_100 ↓ [ 100% ] 100 VUs  4m0s

running (6m23.0s), 004/125 VUs, 1110 complete and 12 interrupted iterations
warm_cache       ✓ [ 100% ] 25 VUs   2m0s
tabs_traffic_100 ↓ [ 100% ] 100 VUs  4m0s

running (6m24.0s), 003/125 VUs, 1111 complete and 12 interrupted iterations
warm_cache       ✓ [ 100% ] 25 VUs   2m0s
tabs_traffic_100 ↓ [ 100% ] 100 VUs  4m0s

running (6m25.0s), 001/125 VUs, 1113 complete and 12 interrupted iterations
warm_cache       ✓ [ 100% ] 25 VUs   2m0s
tabs_traffic_100 ↓ [ 100% ] 100 VUs  4m0s

running (6m26.0s), 001/125 VUs, 1113 complete and 12 interrupted iterations
warm_cache       ✓ [ 100% ] 25 VUs   2m0s
tabs_traffic_100 ↓ [ 100% ] 100 VUs  4m0s

running (6m27.0s), 001/125 VUs, 1113 complete and 12 interrupted iterations
warm_cache       ✓ [ 100% ] 25 VUs   2m0s
tabs_traffic_100 ↓ [ 100% ] 100 VUs  4m0s

running (6m28.0s), 001/125 VUs, 1113 complete and 12 interrupted iterations
warm_cache       ✓ [ 100% ] 25 VUs   2m0s
tabs_traffic_100 ↓ [ 100% ] 100 VUs  4m0s

running (6m29.0s), 001/125 VUs, 1113 complete and 12 interrupted iterations
warm_cache       ✓ [ 100% ] 25 VUs   2m0s
tabs_traffic_100 ↓ [ 100% ] 100 VUs  4m0s

running (6m30.0s), 001/125 VUs, 1113 complete and 12 interrupted iterations
warm_cache       ✓ [ 100% ] 25 VUs   2m0s
tabs_traffic_100 ↓ [ 100% ] 100 VUs  4m0s


  █ THRESHOLDS 

    cache_hit_rate
    ✓ 'rate>0.35' rate=0.00%

    html_duration
    ✗ 'p(95)<1700' p(95)=6.67s

    http_req_duration
    ✗ 'p(95)<1800' p(95)=6.67s
    ✗ 'p(99)<3200' p(99)=9.76s

    http_req_failed
    ✓ 'rate<0.02' rate=0.00%

    server_error_rate
    ✓ 'rate<0.01' rate=0.00%

    throttled_rate
    ✓ 'rate<0.03' rate=0.00%


  █ TOTAL RESULTS 

    checks_total.......: 16743   42.883226/s
    checks_succeeded...: 100.00% 16743 out of 16743
    checks_failed......: 0.00%   0 out of 16743

    ✓ warm: status 200/304
    ✓ main: html status 200/304
    ✓ main: no throttle
    ✓ back: status 200/304

    CUSTOM
    cache_hit_rate.................: 0.00%  0 out of 0
    html_duration..................: avg=1.9s   min=80.07ms med=990.45ms max=20.74s p(90)=5.53s  p(95)=6.67s 
    server_error_rate..............: 0.00%  0 out of 10628
    throttled_rate.................: 0.00%  0 out of 10628

    HTTP
    http_req_duration..............: avg=1.9s   min=80.07ms med=990.04ms max=20.74s p(90)=5.53s  p(95)=6.67s 
      { expected_response:true }...: avg=1.9s   min=80.07ms med=990.04ms max=20.74s p(90)=5.53s  p(95)=6.67s 
    http_req_failed................: 0.00%  0 out of 10631
    http_reqs......................: 10631  27.228787/s

    EXECUTION
    iteration_duration.............: avg=25.21s min=3.66s   med=23.83s   max=1m32s  p(90)=38.99s p(95)=45.06s
    iterations.....................: 1114   2.853247/s
    vus............................: 1      min=1          max=125
    vus_max........................: 125    min=125        max=125

    NETWORK
    data_received..................: 809 MB 2.1 MB/s
    data_sent......................: 5.3 MB 14 kB/s




running (6m30.4s), 000/125 VUs, 1114 complete and 12 interrupted iterations
warm_cache       ✓ [ 100% ] 25 VUs   2m0s
tabs_traffic_100 ✓ [ 100% ] 100 VUs  4m0s
